"No.","Time","Source","Destination","Protocol","Length","Info"
"1","0.000000000","10.0.0.3","10.0.0.2","TCP","74","45266  >  34571 [SYN] Seq=0 Win=29200 Len=0 MSS=1460 SACK_PERM=1 TSval=3787165 TSecr=0 WS=512"
"2","0.151288168","10.0.0.2","10.0.0.3","TCP","74","34571  >  45266 [SYN, ACK] Seq=0 Ack=1 Win=28960 Len=0 MSS=1460 SACK_PERM=1 TSval=3787191 TSecr=3787165 WS=512"
"3","0.201890010","10.0.0.3","10.0.0.2","TCP","66","45266  >  34571 [ACK] Seq=1 Ack=1 Win=29696 Len=0 TSval=3787216 TSecr=3787191"
"4","0.213976555","10.0.0.3","10.0.0.2","TCP","1514","[TCP Previous segment not captured] 45266  >  34571 [ACK] Seq=2049 Ack=1 Win=29696 Len=1448 TSval=3787216 TSecr=3787191"
"5","0.238265423","10.0.0.3","10.0.0.2","TCP","2962","[TCP Previous segment not captured] 45266  >  34571 [ACK] Seq=4945 Ack=1 Win=29696 Len=2896 TSval=3787216 TSecr=3787191"
"6","0.250340917","10.0.0.3","10.0.0.2","TCP","1514","45266  >  34571 [ACK] Seq=7841 Ack=1 Win=29696 Len=1448 TSval=3787216 TSecr=3787191"
"7","0.274535536","10.0.0.3","10.0.0.2","TCP","2962","45266  >  34571 [ACK] Seq=9289 Ack=1 Win=29696 Len=2896 TSval=3787216 TSecr=3787191"
"8","0.286654642","10.0.0.3","10.0.0.2","TCP","1514","45266  >  34571 [ACK] Seq=12185 Ack=1 Win=29696 Len=1448 TSval=3787216 TSecr=3787191"
"9","0.364819432","10.0.0.2","10.0.0.3","TCP","78","[TCP Window Update] 34571  >  45266 [ACK] Seq=1 Ack=1 Win=32256 Len=0 TSval=3787244 TSecr=3787216 SLE=2049 SRE=3497"
"10","0.388664100","10.0.0.2","10.0.0.3","TCP","86","[TCP Window Update] 34571  >  45266 [ACK] Seq=1 Ack=1 Win=37888 Len=0 TSval=3787250 TSecr=3787216 SLE=4945 SRE=7841 SLE=2049 SRE=3497"
"11","0.400484885","10.0.0.2","10.0.0.3","TCP","86","[TCP Window Update] 34571  >  45266 [ACK] Seq=1 Ack=1 Win=40960 Len=0 TSval=3787253 TSecr=3787216 SLE=4945 SRE=9289 SLE=2049 SRE=3497"
"12","0.424914487","10.0.0.2","10.0.0.3","TCP","86","[TCP Window Update] 34571  >  45266 [ACK] Seq=1 Ack=1 Win=46592 Len=0 TSval=3787259 TSecr=3787216 SLE=4945 SRE=12185 SLE=2049 SRE=3497"
"13","0.427022283","10.0.0.3","10.0.0.2","TCP","1514","45266  >  34571 [ACK] Seq=13633 Ack=1 Win=29696 Len=1448 TSval=3787269 TSecr=3787244"
"14","0.436842714","10.0.0.2","10.0.0.3","TCP","86","[TCP Window Update] 34571  >  45266 [ACK] Seq=1 Ack=1 Win=49664 Len=0 TSval=3787262 TSecr=3787216 SLE=4945 SRE=13633 SLE=2049 SRE=3497"
"15","0.450879695","10.0.0.3","10.0.0.2","TCP","1514","[TCP Out-Of-Order] 45266  >  34571 [ACK] Seq=1 Ack=1 Win=29696 Len=1448 TSval=3787275 TSecr=3787250"
"16","0.456139923","10.0.0.3","10.0.0.2","TCP","666","[TCP Out-Of-Order] 45266  >  34571 [PSH, ACK] Seq=1449 Ack=1 Win=29696 Len=600 TSval=3787278 TSecr=3787253"
"17","0.487059354","10.0.0.3","10.0.0.2","TCP","1514","[TCP Out-Of-Order] 45266  >  34571 [ACK] Seq=3497 Ack=1 Win=29696 Len=1448 TSval=3787284 TSecr=3787259"
"18","0.499350634","10.0.0.3","10.0.0.2","TCP","1514","45266  >  34571 [ACK] Seq=15081 Ack=1 Win=29696 Len=1448 TSval=3787284 TSecr=3787259"
"19","0.511327701","10.0.0.3","10.0.0.2","TCP","1514","45266  >  34571 [ACK] Seq=16529 Ack=1 Win=29696 Len=1448 TSval=3787287 TSecr=3787262"
"20","0.577304312","10.0.0.2","10.0.0.3","TCP","86","[TCP Window Update] 34571  >  45266 [ACK] Seq=1 Ack=1 Win=52224 Len=0 TSval=3787297 TSecr=3787216 SLE=4945 SRE=15081 SLE=2049 SRE=3497"
"21","0.601363247","10.0.0.2","10.0.0.3","TCP","86","34571  >  45266 [ACK] Seq=1 Ack=1449 Win=55296 Len=0 TSval=3787303 TSecr=3787275 SLE=4945 SRE=15081 SLE=2049 SRE=3497"
"22","0.606490801","10.0.0.2","10.0.0.3","TCP","78","34571  >  45266 [ACK] Seq=1 Ack=3497 Win=58368 Len=0 TSval=3787305 TSecr=3787278 SLE=4945 SRE=15081"
"23","0.637699345","10.0.0.2","10.0.0.3","TCP","66","34571  >  45266 [ACK] Seq=1 Ack=15081 Win=60928 Len=0 TSval=3787312 TSecr=3787284"
"24","0.650059654","10.0.0.2","10.0.0.3","TCP","66","34571  >  45266 [ACK] Seq=1 Ack=16529 Win=64000 Len=0 TSval=3787316 TSecr=3787284"
"25","0.661510955","10.0.0.2","10.0.0.3","TCP","66","34571  >  45266 [ACK] Seq=1 Ack=17977 Win=67072 Len=0 TSval=3787318 TSecr=3787287"
"26","0.675757224","10.0.0.3","10.0.0.2","TCP","2962","[TCP Previous segment not captured] 45266  >  34571 [ACK] Seq=19425 Ack=1 Win=29696 Len=2896 TSval=3787328 TSecr=3787303"
"27","0.687745750","10.0.0.3","10.0.0.2","TCP","1514","45266  >  34571 [ACK] Seq=22321 Ack=1 Win=29696 Len=1448 TSval=3787330 TSecr=3787305"
"28","0.711984427","10.0.0.3","10.0.0.2","TCP","2962","45266  >  34571 [ACK] Seq=23769 Ack=1 Win=29696 Len=2896 TSval=3787338 TSecr=3787312"
"29","0.724108482","10.0.0.3","10.0.0.2","TCP","1514","45266  >  34571 [ACK] Seq=26665 Ack=1 Win=29696 Len=1448 TSval=3787341 TSecr=3787316"
"30","0.736237126","10.0.0.3","10.0.0.2","TCP","1514","45266  >  34571 [ACK] Seq=28113 Ack=1 Win=29696 Len=1448 TSval=3787343 TSecr=3787318"
"31","0.826398298","10.0.0.2","10.0.0.3","TCP","78","[TCP Window Update] 34571  >  45266 [ACK] Seq=1 Ack=17977 Win=72704 Len=0 TSval=3787360 TSecr=3787287 SLE=19425 SRE=22321"
"32","0.837884580","10.0.0.2","10.0.0.3","TCP","78","[TCP Window Update] 34571  >  45266 [ACK] Seq=1 Ack=17977 Win=75776 Len=0 TSval=3787363 TSecr=3787287 SLE=19425 SRE=23769"
"33","0.862245215","10.0.0.2","10.0.0.3","TCP","78","[TCP Window Update] 34571  >  45266 [ACK] Seq=1 Ack=17977 Win=81408 Len=0 TSval=3787369 TSecr=3787287 SLE=19425 SRE=26665"
"34","0.874372428","10.0.0.2","10.0.0.3","TCP","78","[TCP Window Update] 34571  >  45266 [ACK] Seq=1 Ack=17977 Win=84480 Len=0 TSval=3787372 TSecr=3787287 SLE=19425 SRE=28113"
"35","0.886440909","10.0.0.2","10.0.0.3","TCP","78","[TCP Window Update] 34571  >  45266 [ACK] Seq=1 Ack=17977 Win=87040 Len=0 TSval=3787375 TSecr=3787287 SLE=19425 SRE=29561"
"36","0.900665035","10.0.0.3","10.0.0.2","TCP","2962","45266  >  34571 [ACK] Seq=29561 Ack=1 Win=29696 Len=2896 TSval=3787385 TSecr=3787360"
"37","0.936657043","10.0.0.3","10.0.0.2","TCP","1514","45266  >  34571 [ACK] Seq=32457 Ack=1 Win=29696 Len=1448 TSval=3787397 TSecr=3787372"
"38","0.948796687","10.0.0.3","10.0.0.2","TCP","1514","45266  >  34571 [ACK] Seq=33905 Ack=1 Win=29696 Len=1448 TSval=3787400 TSecr=3787375"
"39","1.051130068","10.0.0.2","10.0.0.3","TCP","78","[TCP Window Update] 34571  >  45266 [ACK] Seq=1 Ack=17977 Win=92672 Len=0 TSval=3787416 TSecr=3787287 SLE=19425 SRE=32457"
"40","1.087548921","10.0.0.2","10.0.0.3","TCP","78","[TCP Window Update] 34571  >  45266 [ACK] Seq=1 Ack=17977 Win=95744 Len=0 TSval=3787425 TSecr=3787287 SLE=19425 SRE=33905"
"41","1.099687609","10.0.0.2","10.0.0.3","TCP","78","[TCP Window Update] 34571  >  45266 [ACK] Seq=1 Ack=17977 Win=98816 Len=0 TSval=3787428 TSecr=3787287 SLE=19425 SRE=35353"
"42","1.125496664","10.0.0.3","10.0.0.2","TCP","2962","45266  >  34571 [ACK] Seq=35353 Ack=1 Win=29696 Len=2896 TSval=3787441 TSecr=3787416"
"43","1.149797314","10.0.0.3","10.0.0.2","TCP","1514","[TCP Out-Of-Order] 45266  >  34571 [ACK] Seq=17977 Ack=1 Win=29696 Len=1448 TSval=3787450 TSecr=3787425"
"44","1.161903986","10.0.0.3","10.0.0.2","TCP","1514","45266  >  34571 [ACK] Seq=38249 Ack=1 Win=29696 Len=1448 TSval=3787453 TSecr=3787428"
"45","1.275939543","10.0.0.2","10.0.0.3","TCP","78","[TCP Window Update] 34571  >  45266 [ACK] Seq=1 Ack=17977 Win=104448 Len=0 TSval=3787472 TSecr=3787287 SLE=19425 SRE=38249"
"46","1.300271130","10.0.0.2","10.0.0.3","TCP","66","34571  >  45266 [ACK] Seq=1 Ack=38249 Win=107520 Len=0 TSval=3787478 TSecr=3787450"
"47","1.312137874","10.0.0.2","10.0.0.3","TCP","66","34571  >  45266 [ACK] Seq=1 Ack=39697 Win=110080 Len=0 TSval=3787481 TSecr=3787453"
"48","1.350260084","10.0.0.3","10.0.0.2","TCP","2962","45266  >  34571 [ACK] Seq=39697 Ack=1 Win=29696 Len=2896 TSval=3787497 TSecr=3787472"
"49","1.374612243","10.0.0.3","10.0.0.2","TCP","2962","45266  >  34571 [ACK] Seq=42593 Ack=1 Win=29696 Len=2896 TSval=3787503 TSecr=3787478"
"50","1.398893704","10.0.0.3","10.0.0.2","TCP","2962","45266  >  34571 [ACK] Seq=45489 Ack=1 Win=29696 Len=2896 TSval=3787503 TSecr=3787478"
"51","1.411148959","10.0.0.3","10.0.0.2","TCP","1514","45266  >  34571 [ACK] Seq=48385 Ack=1 Win=29696 Len=1448 TSval=3787506 TSecr=3787481"
"52","1.500715963","10.0.0.2","10.0.0.3","TCP","66","34571  >  45266 [ACK] Seq=1 Ack=42593 Win=116224 Len=0 TSval=3787528 TSecr=3787497"
"53","1.525087307","10.0.0.2","10.0.0.3","TCP","66","34571  >  45266 [ACK] Seq=1 Ack=45489 Win=121856 Len=0 TSval=3787534 TSecr=3787503"
"54","1.549659025","10.0.0.2","10.0.0.3","TCP","66","34571  >  45266 [ACK] Seq=1 Ack=48385 Win=127488 Len=0 TSval=3787540 TSecr=3787503"
"55","1.561509457","10.0.0.2","10.0.0.3","TCP","66","34571  >  45266 [ACK] Seq=1 Ack=49833 Win=130560 Len=0 TSval=3787543 TSecr=3787506"
"56","1.575035116","10.0.0.3","10.0.0.2","TCP","2962","45266  >  34571 [ACK] Seq=49833 Ack=1 Win=29696 Len=2896 TSval=3787553 TSecr=3787528"
"57","1.599523718","10.0.0.3","10.0.0.2","TCP","2962","45266  >  34571 [ACK] Seq=52729 Ack=1 Win=29696 Len=2896 TSval=3787559 TSecr=3787534"
"58","1.611984496","10.0.0.3","10.0.0.2","TCP","1514","45266  >  34571 [ACK] Seq=55625 Ack=1 Win=29696 Len=1448 TSval=3787566 TSecr=3787540"
"59","1.636095398","10.0.0.3","10.0.0.2","TCP","2962","45266  >  34571 [ACK] Seq=57073 Ack=1 Win=29696 Len=2896 TSval=3787568 TSecr=3787543"
"60","1.725300945","10.0.0.2","10.0.0.3","TCP","66","34571  >  45266 [ACK] Seq=1 Ack=52729 Win=136192 Len=0 TSval=3787584 TSecr=3787553"
"61","1.749889614","10.0.0.2","10.0.0.3","TCP","66","34571  >  45266 [ACK] Seq=1 Ack=55625 Win=142336 Len=0 TSval=3787591 TSecr=3787559"
"62","1.762338539","10.0.0.2","10.0.0.3","TCP","66","34571  >  45266 [ACK] Seq=1 Ack=57073 Win=144896 Len=0 TSval=3787594 TSecr=3787566"
"63","1.786393106","10.0.0.2","10.0.0.3","TCP","66","34571  >  45266 [ACK] Seq=1 Ack=59969 Win=151040 Len=0 TSval=3787600 TSecr=3787568"
"64","1.799619383","10.0.0.3","10.0.0.2","TCP","2962","45266  >  34571 [ACK] Seq=59969 Ack=1 Win=29696 Len=2896 TSval=3787609 TSecr=3787584"
"65","1.824237666","10.0.0.3","10.0.0.2","TCP","2962","45266  >  34571 [ACK] Seq=62865 Ack=1 Win=29696 Len=2896 TSval=3787616 TSecr=3787591"
"66","1.836314562","10.0.0.3","10.0.0.2","TCP","1514","45266  >  34571 [ACK] Seq=65761 Ack=1 Win=29696 Len=1448 TSval=3787619 TSecr=3787594"
"67","1.860823370","10.0.0.3","10.0.0.2","TCP","2962","45266  >  34571 [ACK] Seq=67209 Ack=1 Win=29696 Len=2896 TSval=3787625 TSecr=3787600"
"68","1.949761181","10.0.0.2","10.0.0.3","TCP","66","34571  >  45266 [ACK] Seq=1 Ack=62865 Win=156672 Len=0 TSval=3787641 TSecr=3787609"
"69","1.974646704","10.0.0.2","10.0.0.3","TCP","66","34571  >  45266 [ACK] Seq=1 Ack=65761 Win=162304 Len=0 TSval=3787647 TSecr=3787616"
"70","1.986547609","10.0.0.2","10.0.0.3","TCP","66","34571  >  45266 [ACK] Seq=1 Ack=67209 Win=165376 Len=0 TSval=3787650 TSecr=3787619"
"71","2.011474319","10.0.0.2","10.0.0.3","TCP","66","34571  >  45266 [ACK] Seq=1 Ack=70105 Win=170496 Len=0 TSval=3787656 TSecr=3787625"
"72","2.011984236","10.0.0.3","10.0.0.2","TCP","1514","45266  >  34571 [ACK] Seq=70105 Ack=1 Win=29696 Len=1448 TSval=3787666 TSecr=3787641"
"73","2.049434705","10.0.0.3","10.0.0.2","TCP","2962","45266  >  34571 [ACK] Seq=71553 Ack=1 Win=29696 Len=2896 TSval=3787672 TSecr=3787647"
"74","2.073323651","10.0.0.3","10.0.0.2","TCP","2962","45266  >  34571 [ACK] Seq=74449 Ack=1 Win=29696 Len=2896 TSval=3787675 TSecr=3787650"
"75","2.097425763","10.0.0.3","10.0.0.2","TCP","2962","45266  >  34571 [ACK] Seq=77345 Ack=1 Win=29696 Len=2896 TSval=3787681 TSecr=3787656"
"76","2.162498154","10.0.0.2","10.0.0.3","TCP","66","34571  >  45266 [ACK] Seq=1 Ack=71553 Win=170496 Len=0 TSval=3787694 TSecr=3787666"
"77","2.199590442","10.0.0.2","10.0.0.3","TCP","66","34571  >  45266 [ACK] Seq=1 Ack=74449 Win=170496 Len=0 TSval=3787703 TSecr=3787672"
"78","2.223630531","10.0.0.2","10.0.0.3","TCP","66","34571  >  45266 [ACK] Seq=1 Ack=77345 Win=170496 Len=0 TSval=3787709 TSecr=3787675"
"79","2.236862676","10.0.0.3","10.0.0.2","TCP","2962","45266  >  34571 [ACK] Seq=80241 Ack=1 Win=29696 Len=2896 TSval=3787719 TSecr=3787694"
"80","2.247754579","10.0.0.2","10.0.0.3","TCP","66","34571  >  45266 [ACK] Seq=1 Ack=80241 Win=170496 Len=0 TSval=3787715 TSecr=3787681"
"81","2.273873370","10.0.0.3","10.0.0.2","TCP","2962","45266  >  34571 [ACK] Seq=83137 Ack=1 Win=29696 Len=2896 TSval=3787728 TSecr=3787703"
"82","2.298126195","10.0.0.3","10.0.0.2","TCP","2962","45266  >  34571 [ACK] Seq=86033 Ack=1 Win=29696 Len=2896 TSval=3787734 TSecr=3787709"
"83","2.322381152","10.0.0.3","10.0.0.2","TCP","2962","45266  >  34571 [ACK] Seq=88929 Ack=1 Win=29696 Len=2896 TSval=3787740 TSecr=3787715"
"84","2.387140238","10.0.0.2","10.0.0.3","TCP","66","34571  >  45266 [ACK] Seq=1 Ack=83137 Win=170496 Len=0 TSval=3787750 TSecr=3787719"
"85","2.424172608","10.0.0.2","10.0.0.3","TCP","66","34571  >  45266 [ACK] Seq=1 Ack=86033 Win=170496 Len=0 TSval=3787759 TSecr=3787728"
"86","2.448987753","10.0.0.2","10.0.0.3","TCP","66","34571  >  45266 [ACK] Seq=1 Ack=88929 Win=170496 Len=0 TSval=3787765 TSecr=3787734"
"87","2.461462166","10.0.0.3","10.0.0.2","TCP","2962","45266  >  34571 [ACK] Seq=91825 Ack=1 Win=29696 Len=2896 TSval=3787775 TSecr=3787750"
"88","2.472862711","10.0.0.2","10.0.0.3","TCP","66","34571  >  45266 [ACK] Seq=1 Ack=91825 Win=170496 Len=0 TSval=3787771 TSecr=3787740"
"89","2.498453046","10.0.0.3","10.0.0.2","TCP","2962","45266  >  34571 [ACK] Seq=94721 Ack=1 Win=29696 Len=2896 TSval=3787784 TSecr=3787759"
"90","2.523240629","10.0.0.3","10.0.0.2","TCP","2962","45266  >  34571 [ACK] Seq=97617 Ack=1 Win=29696 Len=2896 TSval=3787790 TSecr=3787765"
"91","2.547549289","10.0.0.3","10.0.0.2","TCP","2962","45266  >  34571 [ACK] Seq=100513 Ack=1 Win=29696 Len=2896 TSval=3787796 TSecr=3787771"
"92","2.559941014","10.0.0.3","10.0.0.2","TCP","1514","45266  >  34571 [ACK] Seq=103409 Ack=1 Win=29696 Len=1448 TSval=3787796 TSecr=3787771"
"93","2.612367668","10.0.0.2","10.0.0.3","TCP","66","34571  >  45266 [ACK] Seq=1 Ack=94721 Win=170496 Len=0 TSval=3787806 TSecr=3787775"
"94","2.648625670","10.0.0.2","10.0.0.3","TCP","66","34571  >  45266 [ACK] Seq=1 Ack=97617 Win=170496 Len=0 TSval=3787815 TSecr=3787784"
"95","2.673501097","10.0.0.2","10.0.0.3","TCP","66","34571  >  45266 [ACK] Seq=1 Ack=100513 Win=170496 Len=0 TSval=3787821 TSecr=3787790"
"96","2.686645537","10.0.0.3","10.0.0.2","TCP","2962","45266  >  34571 [ACK] Seq=104857 Ack=1 Win=29696 Len=2896 TSval=3787831 TSecr=3787806"
"97","2.698213164","10.0.0.2","10.0.0.3","TCP","66","34571  >  45266 [ACK] Seq=1 Ack=103409 Win=170496 Len=0 TSval=3787828 TSecr=3787796"
"98","2.710108895","10.0.0.2","10.0.0.3","TCP","66","34571  >  45266 [ACK] Seq=1 Ack=104857 Win=170496 Len=0 TSval=3787831 TSecr=3787796"
"99","2.722938685","10.0.0.3","10.0.0.2","TCP","2962","45266  >  34571 [ACK] Seq=107753 Ack=1 Win=29696 Len=2896 TSval=3787840 TSecr=3787815"
"100","2.747830844","10.0.0.3","10.0.0.2","TCP","2962","45266  >  34571 [ACK] Seq=110649 Ack=1 Win=29696 Len=2896 TSval=3787846 TSecr=3787821"
"101","2.772548902","10.0.0.3","10.0.0.2","TCP","2962","45266  >  34571 [ACK] Seq=113545 Ack=1 Win=29696 Len=2896 TSval=3787853 TSecr=3787828"
"102","2.784593481","10.0.0.3","10.0.0.2","TCP","1514","45266  >  34571 [ACK] Seq=116441 Ack=1 Win=29696 Len=1448 TSval=3787856 TSecr=3787831"
"103","2.836778757","10.0.0.2","10.0.0.3","TCP","66","34571  >  45266 [ACK] Seq=1 Ack=107753 Win=170496 Len=0 TSval=3787862 TSecr=3787831"
"104","2.873114114","10.0.0.2","10.0.0.3","TCP","66","34571  >  45266 [ACK] Seq=1 Ack=110649 Win=170496 Len=0 TSval=3787871 TSecr=3787840"
"105","2.897989052","10.0.0.2","10.0.0.3","TCP","66","34571  >  45266 [ACK] Seq=1 Ack=113545 Win=170496 Len=0 TSval=3787878 TSecr=3787846"
"106","2.911066034","10.0.0.3","10.0.0.2","TCP","2962","45266  >  34571 [ACK] Seq=117889 Ack=1 Win=29696 Len=2896 TSval=3787887 TSecr=3787862"
"107","2.923022155","10.0.0.2","10.0.0.3","TCP","66","34571  >  45266 [ACK] Seq=1 Ack=116441 Win=170496 Len=0 TSval=3787884 TSecr=3787853"
"108","2.947438075","10.0.0.3","10.0.0.2","TCP","2962","45266  >  34571 [ACK] Seq=120785 Ack=1 Win=29696 Len=2896 TSval=3787896 TSecr=3787871"
"109","2.972307251","10.0.0.3","10.0.0.2","TCP","2962","45266  >  34571 [ACK] Seq=123681 Ack=1 Win=29696 Len=2896 TSval=3787903 TSecr=3787878"
"110","2.973926028","10.0.0.2","10.0.0.3","TCP","66","34571  >  45266 [ACK] Seq=1 Ack=117889 Win=170496 Len=0 TSval=3787897 TSecr=3787856"
"111","2.997407821","10.0.0.3","10.0.0.2","TCP","2962","45266  >  34571 [ACK] Seq=126577 Ack=1 Win=29696 Len=2896 TSval=3787909 TSecr=3787884"
"112","3.048215946","10.0.0.3","10.0.0.2","TCP","2962","45266  >  34571 [ACK] Seq=129473 Ack=1 Win=29696 Len=2896 TSval=3787922 TSecr=3787897"
"113","3.061902403","10.0.0.2","10.0.0.3","TCP","66","34571  >  45266 [ACK] Seq=1 Ack=120785 Win=170496 Len=0 TSval=3787918 TSecr=3787887"
"114","3.098162729","10.0.0.2","10.0.0.3","TCP","66","34571  >  45266 [ACK] Seq=1 Ack=123681 Win=170496 Len=0 TSval=3787928 TSecr=3787896"
"115","3.122562694","10.0.0.2","10.0.0.3","TCP","66","34571  >  45266 [ACK] Seq=1 Ack=126577 Win=170496 Len=0 TSval=3787934 TSecr=3787903"
"116","3.136305967","10.0.0.3","10.0.0.2","TCP","2962","45266  >  34571 [ACK] Seq=132369 Ack=1 Win=29696 Len=2896 TSval=3787944 TSecr=3787918"
"117","3.147717927","10.0.0.2","10.0.0.3","TCP","66","34571  >  45266 [ACK] Seq=1 Ack=129473 Win=170496 Len=0 TSval=3787940 TSecr=3787909"
"118","3.172423246","10.0.0.3","10.0.0.2","TCP","2962","45266  >  34571 [ACK] Seq=135265 Ack=1 Win=29696 Len=2896 TSval=3787953 TSecr=3787928"
"119","3.196987360","10.0.0.3","10.0.0.2","TCP","2962","45266  >  34571 [ACK] Seq=138161 Ack=1 Win=29696 Len=2896 TSval=3787959 TSecr=3787934"
"120","3.198780064","10.0.0.2","10.0.0.3","TCP","66","34571  >  45266 [ACK] Seq=1 Ack=132369 Win=170496 Len=0 TSval=3787953 TSecr=3787922"
"121","3.221972173","10.0.0.3","10.0.0.2","TCP","2962","45266  >  34571 [ACK] Seq=141057 Ack=1 Win=29696 Len=2896 TSval=3787965 TSecr=3787940"
"122","3.273032446","10.0.0.3","10.0.0.2","TCP","2962","45266  >  34571 [ACK] Seq=143953 Ack=1 Win=29696 Len=2896 TSval=3787978 TSecr=3787953"
"123","3.286433208","10.0.0.2","10.0.0.3","TCP","66","34571  >  45266 [ACK] Seq=1 Ack=135265 Win=170496 Len=0 TSval=3787975 TSecr=3787944"
"124","3.322588627","10.0.0.2","10.0.0.3","TCP","66","34571  >  45266 [ACK] Seq=1 Ack=138161 Win=170496 Len=0 TSval=3787984 TSecr=3787953"
"125","3.347380286","10.0.0.2","10.0.0.3","TCP","66","34571  >  45266 [ACK] Seq=1 Ack=141057 Win=170496 Len=0 TSval=3787990 TSecr=3787959"
"126","3.348904563","10.0.0.3","10.0.0.2","TCP","1514","45266  >  34571 [ACK] Seq=146849 Ack=1 Win=29696 Len=1448 TSval=3788000 TSecr=3787975"
"127","3.372404899","10.0.0.2","10.0.0.3","TCP","66","34571  >  45266 [ACK] Seq=1 Ack=143953 Win=170496 Len=0 TSval=3787996 TSecr=3787965"
"128","3.397051623","10.0.0.3","10.0.0.2","TCP","2962","45266  >  34571 [ACK] Seq=148297 Ack=1 Win=29696 Len=2896 TSval=3788009 TSecr=3787984"
"129","3.421716446","10.0.0.3","10.0.0.2","TCP","2962","45266  >  34571 [ACK] Seq=151193 Ack=1 Win=29696 Len=2896 TSval=3788015 TSecr=3787990"
"130","3.423357602","10.0.0.2","10.0.0.3","TCP","66","34571  >  45266 [ACK] Seq=1 Ack=146849 Win=170496 Len=0 TSval=3788009 TSecr=3787978"
"131","3.446707205","10.0.0.3","10.0.0.2","TCP","2962","45266  >  34571 [ACK] Seq=154089 Ack=1 Win=29696 Len=2896 TSval=3788021 TSecr=3787996"
"132","3.470974863","10.0.0.3","10.0.0.2","TCP","2962","45266  >  34571 [ACK] Seq=156985 Ack=1 Win=29696 Len=2896 TSval=3788021 TSecr=3787996"
"133","3.497662876","10.0.0.3","10.0.0.2","TCP","2962","45266  >  34571 [ACK] Seq=159881 Ack=1 Win=29696 Len=2896 TSval=3788034 TSecr=3788009"
"134","3.547622980","10.0.0.2","10.0.0.3","TCP","66","34571  >  45266 [ACK] Seq=1 Ack=151193 Win=170496 Len=0 TSval=3788040 TSecr=3788000"
"135","3.572875400","10.0.0.2","10.0.0.3","TCP","66","34571  >  45266 [ACK] Seq=1 Ack=154089 Win=170496 Len=0 TSval=3788046 TSecr=3788015"
"136","3.597231083","10.0.0.2","10.0.0.3","TCP","66","34571  >  45266 [ACK] Seq=1 Ack=156985 Win=170496 Len=0 TSval=3788052 TSecr=3788021"
"137","3.621259892","10.0.0.2","10.0.0.3","TCP","66","34571  >  45266 [ACK] Seq=1 Ack=159881 Win=170496 Len=0 TSval=3788058 TSecr=3788021"
"138","3.621904290","10.0.0.3","10.0.0.2","TCP","2962","45266  >  34571 [ACK] Seq=162777 Ack=1 Win=29696 Len=2896 TSval=3788065 TSecr=3788040"
"139","3.647207532","10.0.0.3","10.0.0.2","TCP","2962","45266  >  34571 [ACK] Seq=165673 Ack=1 Win=29696 Len=2896 TSval=3788071 TSecr=3788046"
"140","3.648268162","10.0.0.2","10.0.0.3","TCP","66","34571  >  45266 [ACK] Seq=1 Ack=162777 Win=170496 Len=0 TSval=3788065 TSecr=3788034"
"141","3.671523129","10.0.0.3","10.0.0.2","TCP","2962","45266  >  34571 [ACK] Seq=168569 Ack=1 Win=29696 Len=2896 TSval=3788077 TSecr=3788052"
"142","3.695726059","10.0.0.3","10.0.0.2","TCP","2962","45266  >  34571 [ACK] Seq=171465 Ack=1 Win=29696 Len=2896 TSval=3788083 TSecr=3788058"
"143","3.707846599","10.0.0.3","10.0.0.2","TCP","1514","45266  >  34571 [ACK] Seq=174361 Ack=1 Win=29696 Len=1448 TSval=3788083 TSecr=3788058"
"144","3.732113157","10.0.0.3","10.0.0.2","TCP","2962","45266  >  34571 [ACK] Seq=175809 Ack=1 Win=29696 Len=2896 TSval=3788090 TSecr=3788065"
"145","3.772076834","10.0.0.2","10.0.0.3","TCP","66","34571  >  45266 [ACK] Seq=1 Ack=165673 Win=170496 Len=0 TSval=3788096 TSecr=3788065"
"146","3.797369315","10.0.0.2","10.0.0.3","TCP","66","34571  >  45266 [ACK] Seq=1 Ack=168569 Win=170496 Len=0 TSval=3788102 TSecr=3788071"
"147","3.821649645","10.0.0.2","10.0.0.3","TCP","66","34571  >  45266 [ACK] Seq=1 Ack=171465 Win=170496 Len=0 TSval=3788109 TSecr=3788077"
"148","3.845865761","10.0.0.2","10.0.0.3","TCP","66","34571  >  45266 [ACK] Seq=1 Ack=174361 Win=170496 Len=0 TSval=3788115 TSecr=3788083"
"149","3.846369496","10.0.0.3","10.0.0.2","TCP","2962","45266  >  34571 [ACK] Seq=178705 Ack=1 Win=29696 Len=2896 TSval=3788121 TSecr=3788096"
"150","3.871627667","10.0.0.3","10.0.0.2","TCP","2962","45266  >  34571 [ACK] Seq=181601 Ack=1 Win=29696 Len=2896 TSval=3788127 TSecr=3788102"
"151","3.882542363","10.0.0.2","10.0.0.3","TCP","66","34571  >  45266 [ACK] Seq=1 Ack=178705 Win=170496 Len=0 TSval=3788124 TSecr=3788083"
"152","3.895916182","10.0.0.3","10.0.0.2","TCP","2962","45266  >  34571 [ACK] Seq=184497 Ack=1 Win=29696 Len=2896 TSval=3788134 TSecr=3788109"
"153","3.920258797","10.0.0.3","10.0.0.2","TCP","2962","45266  >  34571 [ACK] Seq=187393 Ack=1 Win=29696 Len=2896 TSval=3788140 TSecr=3788115"
"154","3.957114531","10.0.0.3","10.0.0.2","TCP","2962","45266  >  34571 [ACK] Seq=190289 Ack=1 Win=29696 Len=2896 TSval=3788149 TSecr=3788124"
"155","3.981064029","10.0.0.3","10.0.0.2","TCP","2962","45266  >  34571 [ACK] Seq=193185 Ack=1 Win=29696 Len=2896 TSval=3788149 TSecr=3788124"
"156","3.996718877","10.0.0.2","10.0.0.3","TCP","66","34571  >  45266 [ACK] Seq=1 Ack=181601 Win=170496 Len=0 TSval=3788152 TSecr=3788121"
"157","4.022332069","10.0.0.2","10.0.0.3","TCP","66","34571  >  45266 [ACK] Seq=1 Ack=184497 Win=170496 Len=0 TSval=3788159 TSecr=3788127"
"158","4.046231274","10.0.0.2","10.0.0.3","TCP","66","34571  >  45266 [ACK] Seq=1 Ack=187393 Win=170496 Len=0 TSval=3788165 TSecr=3788134"
"159","4.070965970","10.0.0.2","10.0.0.3","TCP","66","34571  >  45266 [ACK] Seq=1 Ack=190289 Win=170496 Len=0 TSval=3788171 TSecr=3788140"
"160","4.071463745","10.0.0.3","10.0.0.2","TCP","2962","45266  >  34571 [ACK] Seq=196081 Ack=1 Win=29696 Len=2896 TSval=3788177 TSecr=3788152"
"161","4.096923850","10.0.0.3","10.0.0.2","TCP","2962","45266  >  34571 [ACK] Seq=198977 Ack=1 Win=29696 Len=2896 TSval=3788184 TSecr=3788159"
"162","4.107316135","10.0.0.2","10.0.0.3","TCP","66","34571  >  45266 [ACK] Seq=1 Ack=193185 Win=170496 Len=0 TSval=3788180 TSecr=3788149"
"163","4.120992080","10.0.0.3","10.0.0.2","TCP","2962","45266  >  34571 [ACK] Seq=201873 Ack=1 Win=29696 Len=2896 TSval=3788190 TSecr=3788165"
"164","4.131520020","10.0.0.2","10.0.0.3","TCP","66","34571  >  45266 [ACK] Seq=1 Ack=196081 Win=170496 Len=0 TSval=3788186 TSecr=3788149"
"165","4.145389632","10.0.0.3","10.0.0.2","TCP","2962","45266  >  34571 [ACK] Seq=204769 Ack=1 Win=29696 Len=2896 TSval=3788196 TSecr=3788171"
"166","4.181667235","10.0.0.3","10.0.0.2","TCP","2962","45266  >  34571 [ACK] Seq=207665 Ack=1 Win=29696 Len=2896 TSval=3788205 TSecr=3788180"
"167","4.205836773","10.0.0.3","10.0.0.2","TCP","2962","45266  >  34571 [ACK] Seq=210561 Ack=1 Win=29696 Len=2896 TSval=3788211 TSecr=3788186"
"168","4.221654351","10.0.0.2","10.0.0.3","TCP","66","34571  >  45266 [ACK] Seq=1 Ack=198977 Win=170496 Len=0 TSval=3788208 TSecr=3788177"
"169","4.247132244","10.0.0.2","10.0.0.3","TCP","66","34571  >  45266 [ACK] Seq=1 Ack=201873 Win=170496 Len=0 TSval=3788215 TSecr=3788184"
"170","4.271300950","10.0.0.2","10.0.0.3","TCP","66","34571  >  45266 [ACK] Seq=1 Ack=204769 Win=170496 Len=0 TSval=3788221 TSecr=3788190"
"171","4.295642065","10.0.0.2","10.0.0.3","TCP","66","34571  >  45266 [ACK] Seq=1 Ack=207665 Win=170496 Len=0 TSval=3788227 TSecr=3788196"
"172","4.296015115","10.0.0.3","10.0.0.2","TCP","2962","45266  >  34571 [ACK] Seq=213457 Ack=1 Win=29696 Len=2896 TSval=3788234 TSecr=3788208"
"173","4.321391653","10.0.0.3","10.0.0.2","TCP","2962","45266  >  34571 [ACK] Seq=216353 Ack=1 Win=29696 Len=2896 TSval=3788240 TSecr=3788215"
"174","4.332032043","10.0.0.2","10.0.0.3","TCP","66","34571  >  45266 [ACK] Seq=1 Ack=210561 Win=170496 Len=0 TSval=3788236 TSecr=3788205"
"175","4.345615218","10.0.0.3","10.0.0.2","TCP","2962","45266  >  34571 [ACK] Seq=219249 Ack=1 Win=29696 Len=2896 TSval=3788246 TSecr=3788221"
"176","4.356013573","10.0.0.2","10.0.0.3","TCP","66","34571  >  45266 [ACK] Seq=1 Ack=213457 Win=170496 Len=0 TSval=3788242 TSecr=3788211"
"177","4.369929743","10.0.0.3","10.0.0.2","TCP","2962","45266  >  34571 [ACK] Seq=222145 Ack=1 Win=29696 Len=2896 TSval=3788252 TSecr=3788227"
"178","4.406328468","10.0.0.3","10.0.0.2","TCP","2962","45266  >  34571 [ACK] Seq=225041 Ack=1 Win=29696 Len=2896 TSval=3788261 TSecr=3788236"
"179","4.430648862","10.0.0.3","10.0.0.2","TCP","2962","45266  >  34571 [ACK] Seq=227937 Ack=1 Win=29696 Len=2896 TSval=3788267 TSecr=3788242"
"180","4.446543226","10.0.0.2","10.0.0.3","TCP","66","34571  >  45266 [ACK] Seq=1 Ack=216353 Win=170496 Len=0 TSval=3788265 TSecr=3788234"
"181","4.471490869","10.0.0.2","10.0.0.3","TCP","66","34571  >  45266 [ACK] Seq=1 Ack=219249 Win=170496 Len=0 TSval=3788271 TSecr=3788240"
"182","4.495957039","10.0.0.2","10.0.0.3","TCP","66","34571  >  45266 [ACK] Seq=1 Ack=222145 Win=170496 Len=0 TSval=3788277 TSecr=3788246"
"183","4.520578079","10.0.0.2","10.0.0.3","TCP","66","34571  >  45266 [ACK] Seq=1 Ack=225041 Win=170496 Len=0 TSval=3788283 TSecr=3788252"
"184","4.520884254","10.0.0.3","10.0.0.2","TCP","2962","45266  >  34571 [ACK] Seq=230833 Ack=1 Win=29696 Len=2896 TSval=3788290 TSecr=3788265"
"185","4.545761354","10.0.0.3","10.0.0.2","TCP","2962","45266  >  34571 [ACK] Seq=233729 Ack=1 Win=29696 Len=2896 TSval=3788296 TSecr=3788271"
"186","4.556838545","10.0.0.2","10.0.0.3","TCP","66","34571  >  45266 [ACK] Seq=1 Ack=227937 Win=170496 Len=0 TSval=3788292 TSecr=3788261"
"187","4.570710686","10.0.0.3","10.0.0.2","TCP","2962","45266  >  34571 [ACK] Seq=236625 Ack=1 Win=29696 Len=2896 TSval=3788302 TSecr=3788277"
"188","4.581457006","10.0.0.2","10.0.0.3","TCP","66","34571  >  45266 [ACK] Seq=1 Ack=230833 Win=170496 Len=0 TSval=3788298 TSecr=3788267"
"189","4.582613446","10.0.0.3","10.0.0.2","TCP","1514","45266  >  34571 [ACK] Seq=239521 Ack=1 Win=29696 Len=1448 TSval=3788302 TSecr=3788277"
"190","4.606967395","10.0.0.3","10.0.0.2","TCP","2962","45266  >  34571 [ACK] Seq=240969 Ack=1 Win=29696 Len=2896 TSval=3788308 TSecr=3788283"
"191","4.631253614","10.0.0.3","10.0.0.2","TCP","2962","45266  >  34571 [ACK] Seq=243865 Ack=1 Win=29696 Len=2896 TSval=3788317 TSecr=3788292"
"192","4.655889871","10.0.0.3","10.0.0.2","TCP","2962","45266  >  34571 [ACK] Seq=246761 Ack=1 Win=29696 Len=2896 TSval=3788324 TSecr=3788298"
"193","4.671364745","10.0.0.2","10.0.0.3","TCP","66","34571  >  45266 [ACK] Seq=1 Ack=233729 Win=170496 Len=0 TSval=3788321 TSecr=3788290"
"194","4.696117342","10.0.0.2","10.0.0.3","TCP","66","34571  >  45266 [ACK] Seq=1 Ack=236625 Win=170496 Len=0 TSval=3788327 TSecr=3788296"
"195","4.721342336","10.0.0.2","10.0.0.3","TCP","66","34571  >  45266 [ACK] Seq=1 Ack=239521 Win=170496 Len=0 TSval=3788333 TSecr=3788302"
"196","4.745634730","10.0.0.3","10.0.0.2","TCP","2962","45266  >  34571 [ACK] Seq=249657 Ack=1 Win=29696 Len=2896 TSval=3788346 TSecr=3788321"
"197","4.757128742","10.0.0.2","10.0.0.3","TCP","66","34571  >  45266 [ACK] Seq=1 Ack=243865 Win=170496 Len=0 TSval=3788342 TSecr=3788302"
"198","4.770384843","10.0.0.3","10.0.0.2","TCP","2962","45266  >  34571 [ACK] Seq=252553 Ack=1 Win=29696 Len=2896 TSval=3788352 TSecr=3788327"
"199","4.781725247","10.0.0.2","10.0.0.3","TCP","66","34571  >  45266 [ACK] Seq=1 Ack=246761 Win=170496 Len=0 TSval=3788349 TSecr=3788317"
"200","4.795833867","10.0.0.3","10.0.0.2","TCP","2962","45266  >  34571 [ACK] Seq=255449 Ack=1 Win=29696 Len=2896 TSval=3788358 TSecr=3788333"
"201","4.806350189","10.0.0.2","10.0.0.3","TCP","66","34571  >  45266 [ACK] Seq=1 Ack=249657 Win=170496 Len=0 TSval=3788355 TSecr=3788324"
"202","4.831391112","10.0.0.3","10.0.0.2","TCP","2962","45266  >  34571 [ACK] Seq=258345 Ack=1 Win=29696 Len=2896 TSval=3788367 TSecr=3788342"
"203","4.855667295","10.0.0.3","10.0.0.2","TCP","2962","45266  >  34571 [ACK] Seq=261241 Ack=1 Win=29696 Len=2896 TSval=3788367 TSecr=3788342"
"204","4.879860943","10.0.0.3","10.0.0.2","TCP","2962","45266  >  34571 [ACK] Seq=264137 Ack=1 Win=29696 Len=2896 TSval=3788374 TSecr=3788349"
"205","4.895922449","10.0.0.2","10.0.0.3","TCP","66","34571  >  45266 [ACK] Seq=1 Ack=252553 Win=170496 Len=0 TSval=3788377 TSecr=3788346"
"206","4.904091412","10.0.0.3","10.0.0.2","TCP","2962","45266  >  34571 [ACK] Seq=267033 Ack=1 Win=29696 Len=2896 TSval=3788380 TSecr=3788355"
"207","4.920862847","10.0.0.2","10.0.0.3","TCP","66","34571  >  45266 [ACK] Seq=1 Ack=255449 Win=170496 Len=0 TSval=3788383 TSecr=3788352"
"208","4.946192851","10.0.0.2","10.0.0.3","TCP","66","34571  >  45266 [ACK] Seq=1 Ack=258345 Win=170496 Len=0 TSval=3788390 TSecr=3788358"
"209","4.970382560","10.0.0.3","10.0.0.2","TCP","2962","45266  >  34571 [ACK] Seq=269929 Ack=1 Win=29696 Len=2896 TSval=3788402 TSecr=3788377"
"210","4.981920246","10.0.0.2","10.0.0.3","TCP","66","34571  >  45266 [ACK] Seq=1 Ack=261241 Win=170496 Len=0 TSval=3788398 TSecr=3788367"
"211","4.995291010","10.0.0.3","10.0.0.2","TCP","2962","45266  >  34571 [ACK] Seq=272825 Ack=1 Win=29696 Len=2896 TSval=3788408 TSecr=3788383"
"212","5.006264466","10.0.0.2","10.0.0.3","TCP","66","34571  >  45266 [ACK] Seq=1 Ack=264137 Win=170496 Len=0 TSval=3788405 TSecr=3788367"
"213","5.020506227","10.0.0.3","10.0.0.2","TCP","2962","45266  >  34571 [ACK] Seq=275721 Ack=1 Win=29696 Len=2896 TSval=3788415 TSecr=3788390"
"214","5.030438187","10.0.0.2","10.0.0.3","TCP","66","34571  >  45266 [ACK] Seq=1 Ack=267033 Win=170496 Len=0 TSval=3788411 TSecr=3788374"
"215","5.054875252","10.0.0.2","10.0.0.3","TCP","66","34571  >  45266 [ACK] Seq=1 Ack=269929 Win=170496 Len=0 TSval=3788417 TSecr=3788380"
"216","5.056252317","10.0.0.3","10.0.0.2","TCP","2962","45266  >  34571 [ACK] Seq=278617 Ack=1 Win=29696 Len=2896 TSval=3788424 TSecr=3788398"
"217","5.081036075","10.0.0.3","10.0.0.2","TCP","2962","45266  >  34571 [ACK] Seq=281513 Ack=1 Win=29696 Len=2896 TSval=3788430 TSecr=3788405"
"218","5.104848608","10.0.0.3","10.0.0.2","TCP","2962","45266  >  34571 [ACK] Seq=284409 Ack=1 Win=29696 Len=2896 TSval=3788436 TSecr=3788411"
"219","5.120839350","10.0.0.2","10.0.0.3","TCP","66","34571  >  45266 [ACK] Seq=1 Ack=272825 Win=170496 Len=0 TSval=3788433 TSecr=3788402"
"220","5.129250549","10.0.0.3","10.0.0.2","TCP","2962","45266  >  34571 [ACK] Seq=287305 Ack=1 Win=29696 Len=2896 TSval=3788442 TSecr=3788417"
"221","5.145790832","10.0.0.2","10.0.0.3","TCP","66","34571  >  45266 [ACK] Seq=1 Ack=275721 Win=170496 Len=0 TSval=3788439 TSecr=3788408"
"222","5.170921936","10.0.0.2","10.0.0.3","TCP","66","34571  >  45266 [ACK] Seq=1 Ack=278617 Win=170496 Len=0 TSval=3788446 TSecr=3788415"
"223","5.195114342","10.0.0.3","10.0.0.2","TCP","2962","45266  >  34571 [ACK] Seq=290201 Ack=1 Win=29696 Len=2896 TSval=3788458 TSecr=3788433"
"224","5.206745457","10.0.0.2","10.0.0.3","TCP","66","34571  >  45266 [ACK] Seq=1 Ack=281513 Win=170496 Len=0 TSval=3788455 TSecr=3788424"
"225","5.220133368","10.0.0.3","10.0.0.2","TCP","2962","45266  >  34571 [ACK] Seq=293097 Ack=1 Win=29696 Len=2896 TSval=3788465 TSecr=3788439"
"226","5.231665854","10.0.0.2","10.0.0.3","TCP","66","34571  >  45266 [ACK] Seq=1 Ack=284409 Win=170496 Len=0 TSval=3788461 TSecr=3788430"
"227","5.245335075","10.0.0.3","10.0.0.2","TCP","2962","45266  >  34571 [ACK] Seq=295993 Ack=1 Win=29696 Len=2896 TSval=3788471 TSecr=3788446"
"228","5.255843843","10.0.0.2","10.0.0.3","TCP","66","34571  >  45266 [ACK] Seq=1 Ack=287305 Win=170496 Len=0 TSval=3788467 TSecr=3788436"
"229","5.279394239","10.0.0.2","10.0.0.3","TCP","66","34571  >  45266 [ACK] Seq=1 Ack=290201 Win=170496 Len=0 TSval=3788473 TSecr=3788442"
"230","5.281141824","10.0.0.3","10.0.0.2","TCP","2962","45266  >  34571 [ACK] Seq=298889 Ack=1 Win=29696 Len=2896 TSval=3788480 TSecr=3788455"
"231","5.305977237","10.0.0.3","10.0.0.2","TCP","2962","45266  >  34571 [ACK] Seq=301785 Ack=1 Win=29696 Len=2896 TSval=3788486 TSecr=3788461"
"232","5.330155275","10.0.0.3","10.0.0.2","TCP","2962","45266  >  34571 [ACK] Seq=304681 Ack=1 Win=29696 Len=2896 TSval=3788492 TSecr=3788467"
"233","5.345284170","10.0.0.2","10.0.0.3","TCP","66","34571  >  45266 [ACK] Seq=1 Ack=293097 Win=170496 Len=0 TSval=3788489 TSecr=3788458"
"234","5.354388357","10.0.0.3","10.0.0.2","TCP","2962","45266  >  34571 [ACK] Seq=307577 Ack=1 Win=29696 Len=2896 TSval=3788498 TSecr=3788473"
"235","5.366489876","10.0.0.3","10.0.0.2","TCP","1514","45266  >  34571 [ACK] Seq=310473 Ack=1 Win=29696 Len=1448 TSval=3788498 TSecr=3788473"
"236","5.370785763","10.0.0.2","10.0.0.3","TCP","66","34571  >  45266 [ACK] Seq=1 Ack=295993 Win=170496 Len=0 TSval=3788496 TSecr=3788465"
"237","5.395514565","10.0.0.2","10.0.0.3","TCP","66","34571  >  45266 [ACK] Seq=1 Ack=298889 Win=170496 Len=0 TSval=3788502 TSecr=3788471"
"238","5.419554084","10.0.0.3","10.0.0.2","TCP","2962","45266  >  34571 [ACK] Seq=311921 Ack=1 Win=29696 Len=2896 TSval=3788514 TSecr=3788489"
"239","5.431291514","10.0.0.2","10.0.0.3","TCP","66","34571  >  45266 [ACK] Seq=1 Ack=301785 Win=170496 Len=0 TSval=3788511 TSecr=3788480"
"240","5.445107710","10.0.0.3","10.0.0.2","TCP","2962","45266  >  34571 [ACK] Seq=314817 Ack=1 Win=29696 Len=2896 TSval=3788521 TSecr=3788496"
"241","5.456523836","10.0.0.2","10.0.0.3","TCP","66","34571  >  45266 [ACK] Seq=1 Ack=304681 Win=170496 Len=0 TSval=3788517 TSecr=3788486"
"242","5.469901585","10.0.0.3","10.0.0.2","TCP","2962","45266  >  34571 [ACK] Seq=317713 Ack=1 Win=29696 Len=2896 TSval=3788527 TSecr=3788502"
"243","5.480721974","10.0.0.2","10.0.0.3","TCP","66","34571  >  45266 [ACK] Seq=1 Ack=307577 Win=170496 Len=0 TSval=3788523 TSecr=3788492"
"244","5.505053685","10.0.0.2","10.0.0.3","TCP","66","34571  >  45266 [ACK] Seq=1 Ack=310473 Win=170496 Len=0 TSval=3788529 TSecr=3788498"
"245","5.505583190","10.0.0.3","10.0.0.2","TCP","2962","45266  >  34571 [ACK] Seq=320609 Ack=1 Win=29696 Len=2896 TSval=3788536 TSecr=3788511"
"246","5.531003113","10.0.0.3","10.0.0.2","TCP","2962","45266  >  34571 [ACK] Seq=323505 Ack=1 Win=29696 Len=2896 TSval=3788542 TSecr=3788517"
"247","5.555222726","10.0.0.3","10.0.0.2","TCP","2962","45266  >  34571 [ACK] Seq=326401 Ack=1 Win=29696 Len=2896 TSval=3788548 TSecr=3788523"
"248","5.557722688","10.0.0.2","10.0.0.3","TCP","66","34571  >  45266 [ACK] Seq=1 Ack=311921 Win=170496 Len=0 TSval=3788543 TSecr=3788498"
"249","5.570145043","10.0.0.2","10.0.0.3","TCP","66","34571  >  45266 [ACK] Seq=1 Ack=314817 Win=170496 Len=0 TSval=3788546 TSecr=3788514"
"250","5.579520360","10.0.0.3","10.0.0.2","TCP","2962","45266  >  34571 [ACK] Seq=329297 Ack=1 Win=29696 Len=2896 TSval=3788554 TSecr=3788529"
"251","5.595918276","10.0.0.2","10.0.0.3","TCP","66","34571  >  45266 [ACK] Seq=1 Ack=317713 Win=170496 Len=0 TSval=3788552 TSecr=3788521"
"252","5.620724378","10.0.0.2","10.0.0.3","TCP","66","34571  >  45266 [ACK] Seq=1 Ack=320609 Win=170496 Len=0 TSval=3788558 TSecr=3788527"
"253","5.631989927","10.0.0.3","10.0.0.2","TCP","2962","45266  >  34571 [ACK] Seq=332193 Ack=1 Win=29696 Len=2896 TSval=3788568 TSecr=3788543"
"254","5.655729103","10.0.0.2","10.0.0.3","TCP","66","34571  >  45266 [ACK] Seq=1 Ack=323505 Win=170496 Len=0 TSval=3788567 TSecr=3788536"
"255","5.656217169","10.0.0.3","10.0.0.2","TCP","2962","45266  >  34571 [ACK] Seq=335089 Ack=1 Win=29696 Len=2896 TSval=3788571 TSecr=3788546"
"256","5.680503070","10.0.0.3","10.0.0.2","TCP","2962","45266  >  34571 [ACK] Seq=337985 Ack=1 Win=29696 Len=2896 TSval=3788577 TSecr=3788552"
"257","5.681535858","10.0.0.2","10.0.0.3","TCP","66","34571  >  45266 [ACK] Seq=1 Ack=326401 Win=170496 Len=0 TSval=3788573 TSecr=3788542"
"258","5.704797042","10.0.0.3","10.0.0.2","TCP","2962","45266  >  34571 [ACK] Seq=340881 Ack=1 Win=29696 Len=2896 TSval=3788583 TSecr=3788558"
"259","5.706004422","10.0.0.2","10.0.0.3","TCP","66","34571  >  45266 [ACK] Seq=1 Ack=329297 Win=170496 Len=0 TSval=3788579 TSecr=3788548"
"260","5.729880954","10.0.0.2","10.0.0.3","TCP","66","34571  >  45266 [ACK] Seq=1 Ack=332193 Win=170496 Len=0 TSval=3788586 TSecr=3788554"
"261","5.730005028","10.0.0.3","10.0.0.2","TCP","2962","45266  >  34571 [ACK] Seq=343777 Ack=1 Win=29696 Len=2896 TSval=3788592 TSecr=3788567"
"262","5.754290107","10.0.0.3","10.0.0.2","TCP","2962","45266  >  34571 [ACK] Seq=346673 Ack=1 Win=29696 Len=2896 TSval=3788592 TSecr=3788567"
"263","5.778454552","10.0.0.3","10.0.0.2","TCP","2962","45266  >  34571 [ACK] Seq=349569 Ack=1 Win=29696 Len=2896 TSval=3788599 TSecr=3788573"
"264","5.782376808","10.0.0.2","10.0.0.3","TCP","66","34571  >  45266 [ACK] Seq=1 Ack=335089 Win=170496 Len=0 TSval=3788599 TSecr=3788568"
"265","5.802671406","10.0.0.3","10.0.0.2","TCP","2962","45266  >  34571 [ACK] Seq=352465 Ack=1 Win=29696 Len=2896 TSval=3788605 TSecr=3788579"
"266","5.806438318","10.0.0.2","10.0.0.3","TCP","66","34571  >  45266 [ACK] Seq=1 Ack=337985 Win=170496 Len=0 TSval=3788605 TSecr=3788571"
"267","5.826896298","10.0.0.3","10.0.0.2","TCP","2962","45266  >  34571 [ACK] Seq=355361 Ack=1 Win=29696 Len=2896 TSval=3788611 TSecr=3788586"
"268","5.830709187","10.0.0.2","10.0.0.3","TCP","66","34571  >  45266 [ACK] Seq=1 Ack=340881 Win=170496 Len=0 TSval=3788611 TSecr=3788577"
"269","5.855319228","10.0.0.2","10.0.0.3","TCP","66","34571  >  45266 [ACK] Seq=1 Ack=343777 Win=170496 Len=0 TSval=3788617 TSecr=3788583"
"270","5.856855161","10.0.0.3","10.0.0.2","TCP","2962","45266  >  34571 [ACK] Seq=358257 Ack=1 Win=29696 Len=2896 TSval=3788624 TSecr=3788599"
"271","5.880248053","10.0.0.2","10.0.0.3","TCP","66","34571  >  45266 [ACK] Seq=1 Ack=346673 Win=170496 Len=0 TSval=3788623 TSecr=3788592"
"272","5.881046162","10.0.0.3","10.0.0.2","TCP","2962","45266  >  34571 [ACK] Seq=361153 Ack=1 Win=29696 Len=2896 TSval=3788630 TSecr=3788605"
"273","5.904833517","10.0.0.2","10.0.0.3","TCP","66","34571  >  45266 [ACK] Seq=1 Ack=349569 Win=170496 Len=0 TSval=3788629 TSecr=3788592"
"274","5.905191970","10.0.0.3","10.0.0.2","TCP","2962","45266  >  34571 [ACK] Seq=364049 Ack=1 Win=29696 Len=2896 TSval=3788636 TSecr=3788611"
"275","5.929447785","10.0.0.2","10.0.0.3","TCP","66","34571  >  45266 [ACK] Seq=1 Ack=352465 Win=170496 Len=0 TSval=3788635 TSecr=3788599"
"276","5.929662990","10.0.0.3","10.0.0.2","TCP","2962","45266  >  34571 [ACK] Seq=366945 Ack=1 Win=29696 Len=2896 TSval=3788642 TSecr=3788617"
"277","5.953632807","10.0.0.2","10.0.0.3","TCP","66","34571  >  45266 [ACK] Seq=1 Ack=355361 Win=170496 Len=0 TSval=3788641 TSecr=3788605"
"278","5.954568052","10.0.0.3","10.0.0.2","TCP","2962","45266  >  34571 [ACK] Seq=369841 Ack=1 Win=29696 Len=2896 TSval=3788648 TSecr=3788623"
"279","5.977498249","10.0.0.2","10.0.0.3","TCP","66","34571  >  45266 [ACK] Seq=1 Ack=358257 Win=170496 Len=0 TSval=3788647 TSecr=3788611"
"280","5.979548547","10.0.0.3","10.0.0.2","TCP","2962","45266  >  34571 [ACK] Seq=372737 Ack=1 Win=29696 Len=2896 TSval=3788654 TSecr=3788629"
"281","6.003431558","10.0.0.3","10.0.0.2","TCP","2962","45266  >  34571 [ACK] Seq=375633 Ack=1 Win=29696 Len=2896 TSval=3788654 TSecr=3788629"
"282","6.007458356","10.0.0.2","10.0.0.3","TCP","66","34571  >  45266 [ACK] Seq=1 Ack=361153 Win=170496 Len=0 TSval=3788655 TSecr=3788624"
"283","6.027767643","10.0.0.3","10.0.0.2","TCP","2962","45266  >  34571 [ACK] Seq=378529 Ack=1 Win=29696 Len=2896 TSval=3788660 TSecr=3788635"
"284","6.031725892","10.0.0.2","10.0.0.3","TCP","66","34571  >  45266 [ACK] Seq=1 Ack=364049 Win=170496 Len=0 TSval=3788661 TSecr=3788630"
"285","6.052148428","10.0.0.3","10.0.0.2","TCP","2962","45266  >  34571 [ACK] Seq=381425 Ack=1 Win=29696 Len=2896 TSval=3788667 TSecr=3788641"
"286","6.055415399","10.0.0.2","10.0.0.3","TCP","66","34571  >  45266 [ACK] Seq=1 Ack=366945 Win=170496 Len=0 TSval=3788667 TSecr=3788636"
"287","6.076030590","10.0.0.3","10.0.0.2","TCP","2962","45266  >  34571 [ACK] Seq=384321 Ack=1 Win=29696 Len=2896 TSval=3788672 TSecr=3788647"
"288","6.080851390","10.0.0.2","10.0.0.3","TCP","66","34571  >  45266 [ACK] Seq=1 Ack=369841 Win=170496 Len=0 TSval=3788673 TSecr=3788642"
"289","6.100428890","10.0.0.3","10.0.0.2","TCP","2962","45266  >  34571 [ACK] Seq=387217 Ack=1 Win=29696 Len=2896 TSval=3788680 TSecr=3788655"
"290","6.104947641","10.0.0.2","10.0.0.3","TCP","66","34571  >  45266 [ACK] Seq=1 Ack=372737 Win=170496 Len=0 TSval=3788679 TSecr=3788648"
"291","6.124479836","10.0.0.3","10.0.0.2","TCP","2962","45266  >  34571 [ACK] Seq=390113 Ack=1 Win=29696 Len=2896 TSval=3788686 TSecr=3788661"
"292","6.129854281","10.0.0.2","10.0.0.3","TCP","66","34571  >  45266 [ACK] Seq=1 Ack=375633 Win=170496 Len=0 TSval=3788686 TSecr=3788654"
"293","6.136568943","10.0.0.3","10.0.0.2","TCP","1514","45266  >  34571 [ACK] Seq=393009 Ack=1 Win=29696 Len=1448 TSval=3788686 TSecr=3788661"
"294","6.154600046","10.0.0.2","10.0.0.3","TCP","66","34571  >  45266 [ACK] Seq=1 Ack=378529 Win=170496 Len=0 TSval=3788692 TSecr=3788654"
"295","6.160795093","10.0.0.3","10.0.0.2","TCP","2962","45266  >  34571 [ACK] Seq=394457 Ack=1 Win=29696 Len=2896 TSval=3788692 TSecr=3788667"
"296","6.178305978","10.0.0.2","10.0.0.3","TCP","66","34571  >  45266 [ACK] Seq=1 Ack=381425 Win=170496 Len=0 TSval=3788698 TSecr=3788660"
"297","6.185080391","10.0.0.3","10.0.0.2","TCP","2962","45266  >  34571 [ACK] Seq=397353 Ack=1 Win=29696 Len=2896 TSval=3788698 TSecr=3788673"
"298","6.202603751","10.0.0.2","10.0.0.3","TCP","66","34571  >  45266 [ACK] Seq=1 Ack=384321 Win=170496 Len=0 TSval=3788704 TSecr=3788667"
"299","6.209263296","10.0.0.3","10.0.0.2","TCP","2962","45266  >  34571 [ACK] Seq=400249 Ack=1 Win=29696 Len=2896 TSval=3788704 TSecr=3788679"
"300","6.226846743","10.0.0.2","10.0.0.3","TCP","66","34571  >  45266 [ACK] Seq=1 Ack=387217 Win=170496 Len=0 TSval=3788710 TSecr=3788672"
"301","6.233568419","10.0.0.3","10.0.0.2","TCP","2962","45266  >  34571 [ACK] Seq=403145 Ack=1 Win=29696 Len=2896 TSval=3788711 TSecr=3788686"
"302","6.250677986","10.0.0.2","10.0.0.3","TCP","66","34571  >  45266 [ACK] Seq=1 Ack=390113 Win=170496 Len=0 TSval=3788716 TSecr=3788680"
"303","6.257828682","10.0.0.3","10.0.0.2","TCP","2962","45266  >  34571 [ACK] Seq=406041 Ack=1 Win=29696 Len=2896 TSval=3788711 TSecr=3788686"
"304","6.274840179","10.0.0.2","10.0.0.3","TCP","66","34571  >  45266 [ACK] Seq=1 Ack=393009 Win=170496 Len=0 TSval=3788722 TSecr=3788686"
"305","6.281918525","10.0.0.3","10.0.0.2","TCP","2962","45266  >  34571 [ACK] Seq=408937 Ack=1 Win=29696 Len=2896 TSval=3788717 TSecr=3788692"
"306","6.306161716","10.0.0.3","10.0.0.2","TCP","2962","45266  >  34571 [ACK] Seq=411833 Ack=1 Win=29696 Len=2896 TSval=3788723 TSecr=3788698"
"307","6.310953279","10.0.0.2","10.0.0.3","TCP","66","34571  >  45266 [ACK] Seq=1 Ack=397353 Win=170496 Len=0 TSval=3788731 TSecr=3788686"
"308","6.330412923","10.0.0.3","10.0.0.2","TCP","2962","45266  >  34571 [ACK] Seq=414729 Ack=1 Win=29696 Len=2896 TSval=3788729 TSecr=3788704"
"309","6.335230044","10.0.0.2","10.0.0.3","TCP","66","34571  >  45266 [ACK] Seq=1 Ack=400249 Win=170496 Len=0 TSval=3788737 TSecr=3788698"
"310","6.354592544","10.0.0.3","10.0.0.2","TCP","2962","45266  >  34571 [ACK] Seq=417625 Ack=1 Win=29696 Len=2896 TSval=3788735 TSecr=3788710"
"311","6.359449556","10.0.0.2","10.0.0.3","TCP","66","34571  >  45266 [ACK] Seq=1 Ack=403145 Win=170496 Len=0 TSval=3788743 TSecr=3788704"
"312","6.378996116","10.0.0.3","10.0.0.2","TCP","2962","45266  >  34571 [ACK] Seq=420521 Ack=1 Win=29696 Len=2896 TSval=3788741 TSecr=3788716"
"313","6.383735196","10.0.0.2","10.0.0.3","TCP","66","34571  >  45266 [ACK] Seq=1 Ack=406041 Win=170496 Len=0 TSval=3788749 TSecr=3788711"
"314","6.403236530","10.0.0.3","10.0.0.2","TCP","2962","45266  >  34571 [ACK] Seq=423417 Ack=1 Win=29696 Len=2896 TSval=3788747 TSecr=3788722"
"315","6.408081454","10.0.0.2","10.0.0.3","TCP","66","34571  >  45266 [ACK] Seq=1 Ack=408937 Win=170496 Len=0 TSval=3788755 TSecr=3788711"
"316","6.427255668","10.0.0.3","10.0.0.2","TCP","2962","45266  >  34571 [ACK] Seq=426313 Ack=1 Win=29696 Len=2896 TSval=3788747 TSecr=3788722"
"317","6.432194993","10.0.0.2","10.0.0.3","TCP","66","34571  >  45266 [ACK] Seq=1 Ack=411833 Win=170496 Len=0 TSval=3788761 TSecr=3788717"
"318","6.451569131","10.0.0.3","10.0.0.2","TCP","2962","45266  >  34571 [ACK] Seq=429209 Ack=1 Win=29696 Len=2896 TSval=3788756 TSecr=3788731"
"319","6.456411875","10.0.0.2","10.0.0.3","TCP","66","34571  >  45266 [ACK] Seq=1 Ack=414729 Win=170496 Len=0 TSval=3788767 TSecr=3788723"
"320","6.463642406","10.0.0.3","10.0.0.2","TCP","1514","45266  >  34571 [ACK] Seq=432105 Ack=1 Win=29696 Len=1448 TSval=3788756 TSecr=3788731"
"321","6.480657852","10.0.0.2","10.0.0.3","TCP","66","34571  >  45266 [ACK] Seq=1 Ack=417625 Win=170496 Len=0 TSval=3788773 TSecr=3788729"
"322","6.487888452","10.0.0.3","10.0.0.2","TCP","2962","45266  >  34571 [ACK] Seq=433553 Ack=1 Win=29696 Len=2896 TSval=3788762 TSecr=3788737"
"323","6.504987886","10.0.0.2","10.0.0.3","TCP","66","34571  >  45266 [ACK] Seq=1 Ack=420521 Win=170496 Len=0 TSval=3788779 TSecr=3788735"
"324","6.512045446","10.0.0.3","10.0.0.2","TCP","2962","45266  >  34571 [ACK] Seq=436449 Ack=1 Win=29696 Len=2896 TSval=3788768 TSecr=3788743"
"325","6.529186308","10.0.0.2","10.0.0.3","TCP","66","34571  >  45266 [ACK] Seq=1 Ack=423417 Win=170496 Len=0 TSval=3788785 TSecr=3788741"
"326","6.536259388","10.0.0.3","10.0.0.2","TCP","2962","45266  >  34571 [ACK] Seq=439345 Ack=1 Win=29696 Len=2896 TSval=3788774 TSecr=3788749"
"327","6.553756838","10.0.0.2","10.0.0.3","TCP","66","34571  >  45266 [ACK] Seq=1 Ack=426313 Win=170496 Len=0 TSval=3788791 TSecr=3788747"
"328","6.560977140","10.0.0.3","10.0.0.2","TCP","2962","45266  >  34571 [ACK] Seq=442241 Ack=1 Win=29696 Len=2896 TSval=3788780 TSecr=3788755"
"329","6.577574050","10.0.0.2","10.0.0.3","TCP","66","34571  >  45266 [ACK] Seq=1 Ack=429209 Win=170496 Len=0 TSval=3788797 TSecr=3788747"
"330","6.584748716","10.0.0.3","10.0.0.2","TCP","2962","45266  >  34571 [ACK] Seq=445137 Ack=1 Win=29696 Len=2896 TSval=3788780 TSecr=3788755"
"331","6.602529368","10.0.0.2","10.0.0.3","TCP","66","34571  >  45266 [ACK] Seq=1 Ack=432105 Win=170496 Len=0 TSval=3788804 TSecr=3788756"
"332","6.609016864","10.0.0.3","10.0.0.2","TCP","2962","45266  >  34571 [ACK] Seq=448033 Ack=1 Win=29696 Len=2896 TSval=3788786 TSecr=3788761"
"333","6.633294013","10.0.0.3","10.0.0.2","TCP","2962","45266  >  34571 [ACK] Seq=450929 Ack=1 Win=29696 Len=2896 TSval=3788792 TSecr=3788767"
"334","6.638514372","10.0.0.2","10.0.0.3","TCP","66","34571  >  45266 [ACK] Seq=1 Ack=436449 Win=170496 Len=0 TSval=3788813 TSecr=3788756"
"335","6.657755916","10.0.0.3","10.0.0.2","TCP","2962","45266  >  34571 [ACK] Seq=453825 Ack=1 Win=29696 Len=2896 TSval=3788798 TSecr=3788773"
"336","6.662452420","10.0.0.2","10.0.0.3","TCP","66","34571  >  45266 [ACK] Seq=1 Ack=439345 Win=170496 Len=0 TSval=3788819 TSecr=3788768"
"337","6.681756942","10.0.0.3","10.0.0.2","TCP","2962","[TCP Previous segment not captured] 45266  >  34571 [ACK] Seq=459617 Ack=1 Win=29696 Len=2896 TSval=3788810 TSecr=3788785"
"338","6.686687907","10.0.0.2","10.0.0.3","TCP","66","34571  >  45266 [ACK] Seq=1 Ack=442241 Win=170496 Len=0 TSval=3788825 TSecr=3788774"
"339","6.706145786","10.0.0.3","10.0.0.2","TCP","2962","45266  >  34571 [ACK] Seq=462513 Ack=1 Win=29696 Len=2896 TSval=3788817 TSecr=3788791"
"340","6.711457075","10.0.0.2","10.0.0.3","TCP","66","34571  >  45266 [ACK] Seq=1 Ack=445137 Win=170496 Len=0 TSval=3788831 TSecr=3788780"
"341","6.730072589","10.0.0.3","10.0.0.2","TCP","2962","45266  >  34571 [ACK] Seq=465409 Ack=1 Win=29696 Len=2896 TSval=3788817 TSecr=3788791"
"342","6.735145159","10.0.0.2","10.0.0.3","TCP","66","34571  >  45266 [ACK] Seq=1 Ack=448033 Win=170496 Len=0 TSval=3788837 TSecr=3788780"
"343","6.754284511","10.0.0.3","10.0.0.2","TCP","2962","45266  >  34571 [ACK] Seq=468305 Ack=1 Win=29696 Len=2896 TSval=3788823 TSecr=3788797"
"344","6.759399612","10.0.0.2","10.0.0.3","TCP","66","34571  >  45266 [ACK] Seq=1 Ack=450929 Win=170496 Len=0 TSval=3788843 TSecr=3788786"
"345","6.778530558","10.0.0.3","10.0.0.2","TCP","2962","45266  >  34571 [ACK] Seq=471201 Ack=1 Win=29696 Len=2896 TSval=3788829 TSecr=3788804"
"346","6.783617125","10.0.0.2","10.0.0.3","TCP","66","34571  >  45266 [ACK] Seq=1 Ack=453825 Win=170496 Len=0 TSval=3788849 TSecr=3788792"
"347","6.803101354","10.0.0.3","10.0.0.2","TCP","2962","45266  >  34571 [ACK] Seq=474097 Ack=1 Win=29696 Len=2896 TSval=3788838 TSecr=3788813"
"348","6.808460907","10.0.0.2","10.0.0.3","TCP","66","34571  >  45266 [ACK] Seq=1 Ack=456721 Win=170496 Len=0 TSval=3788855 TSecr=3788798"
"349","6.826978869","10.0.0.3","10.0.0.2","TCP","2962","45266  >  34571 [ACK] Seq=476993 Ack=1 Win=29696 Len=2896 TSval=3788838 TSecr=3788813"
"350","6.831894114","10.0.0.2","10.0.0.3","TCP","78","[TCP Dup ACK 348#1] 34571  >  45266 [ACK] Seq=1 Ack=456721 Win=170496 Len=0 TSval=3788861 TSecr=3788798 SLE=459617 SRE=462513"
"351","6.851204296","10.0.0.3","10.0.0.2","TCP","2962","45266  >  34571 [ACK] Seq=479889 Ack=1 Win=29696 Len=2896 TSval=3788844 TSecr=3788819"
"352","6.856374857","10.0.0.2","10.0.0.3","TCP","78","[TCP Dup ACK 348#2] 34571  >  45266 [ACK] Seq=1 Ack=456721 Win=170496 Len=0 TSval=3788867 TSecr=3788798 SLE=459617 SRE=465409"
"353","6.875441456","10.0.0.3","10.0.0.2","TCP","2962","45266  >  34571 [ACK] Seq=482785 Ack=1 Win=29696 Len=2896 TSval=3788850 TSecr=3788825"
"354","6.880434266","10.0.0.2","10.0.0.3","TCP","78","[TCP Dup ACK 348#3] 34571  >  45266 [ACK] Seq=1 Ack=456721 Win=170496 Len=0 TSval=3788873 TSecr=3788798 SLE=459617 SRE=468305"
"355","6.899666995","10.0.0.3","10.0.0.2","TCP","2962","45266  >  34571 [ACK] Seq=485681 Ack=1 Win=29696 Len=2896 TSval=3788856 TSecr=3788831"
"356","6.904644653","10.0.0.2","10.0.0.3","TCP","78","[TCP Dup ACK 348#4] 34571  >  45266 [ACK] Seq=1 Ack=456721 Win=170496 Len=0 TSval=3788879 TSecr=3788798 SLE=459617 SRE=471201"
"357","6.923859149","10.0.0.3","10.0.0.2","TCP","2962","45266  >  34571 [ACK] Seq=488577 Ack=1 Win=29696 Len=2896 TSval=3788862 TSecr=3788837"
"358","6.928665461","10.0.0.2","10.0.0.3","TCP","78","[TCP Dup ACK 348#5] 34571  >  45266 [ACK] Seq=1 Ack=456721 Win=170496 Len=0 TSval=3788885 TSecr=3788798 SLE=459617 SRE=474097"
"359","6.948216474","10.0.0.3","10.0.0.2","TCP","2962","45266  >  34571 [ACK] Seq=491473 Ack=1 Win=29696 Len=2896 TSval=3788862 TSecr=3788837"
"360","6.953805134","10.0.0.2","10.0.0.3","TCP","78","[TCP Dup ACK 348#6] 34571  >  45266 [ACK] Seq=1 Ack=456721 Win=170496 Len=0 TSval=3788891 TSecr=3788798 SLE=459617 SRE=476993"
"361","6.972350732","10.0.0.3","10.0.0.2","TCP","2962","45266  >  34571 [ACK] Seq=494369 Ack=1 Win=29696 Len=2896 TSval=3788868 TSecr=3788843"
"362","6.977128720","10.0.0.2","10.0.0.3","TCP","78","[TCP Dup ACK 348#7] 34571  >  45266 [ACK] Seq=1 Ack=456721 Win=170496 Len=0 TSval=3788897 TSecr=3788798 SLE=459617 SRE=479889"
"363","6.984410987","10.0.0.3","10.0.0.2","TCP","1514","45266  >  34571 [ACK] Seq=497265 Ack=1 Win=29696 Len=1448 TSval=3788874 TSecr=3788849"
"364","7.001717728","10.0.0.2","10.0.0.3","TCP","78","[TCP Dup ACK 348#8] 34571  >  45266 [ACK] Seq=1 Ack=456721 Win=170496 Len=0 TSval=3788903 TSecr=3788798 SLE=459617 SRE=482785"
"365","7.008949942","10.0.0.3","10.0.0.2","TCP","2962","45266  >  34571 [ACK] Seq=498713 Ack=1 Win=29696 Len=2896 TSval=3788874 TSecr=3788849"
"366","7.026568300","10.0.0.2","10.0.0.3","TCP","78","[TCP Dup ACK 348#9] 34571  >  45266 [ACK] Seq=1 Ack=456721 Win=170496 Len=0 TSval=3788910 TSecr=3788798 SLE=459617 SRE=485681"
"367","7.033342162","10.0.0.3","10.0.0.2","TCP","2962","45266  >  34571 [ACK] Seq=501609 Ack=1 Win=29696 Len=2896 TSval=3788880 TSecr=3788855"
"368","7.045344920","10.0.0.3","10.0.0.2","TCP","1514","[TCP Fast Retransmission] 45266  >  34571 [ACK] Seq=456721 Ack=1 Win=29696 Len=1448 TSval=3788886 TSecr=3788861"
"369","7.050584957","10.0.0.2","10.0.0.3","TCP","78","[TCP Dup ACK 348#10] 34571  >  45266 [ACK] Seq=1 Ack=456721 Win=170496 Len=0 TSval=3788916 TSecr=3788798 SLE=459617 SRE=488577"
"370","7.057293006","10.0.0.3","10.0.0.2","TCP","1514","45266  >  34571 [ACK] Seq=504505 Ack=1 Win=29696 Len=1448 TSval=3788886 TSecr=3788861"
"371","7.069222917","10.0.0.3","10.0.0.2","TCP","1514","[TCP Out-Of-Order] 45266  >  34571 [ACK] Seq=458169 Ack=1 Win=29696 Len=1448 TSval=3788892 TSecr=3788867"
"372","7.074131942","10.0.0.2","10.0.0.3","TCP","78","[TCP Dup ACK 348#11] 34571  >  45266 [ACK] Seq=1 Ack=456721 Win=170496 Len=0 TSval=3788922 TSecr=3788798 SLE=459617 SRE=491473"
"373","7.093776957","10.0.0.3","10.0.0.2","TCP","2962","45266  >  34571 [ACK] Seq=505953 Ack=1 Win=29696 Len=2896 TSval=3788898 TSecr=3788873"
"374","7.098935188","10.0.0.2","10.0.0.3","TCP","78","[TCP Dup ACK 348#12] 34571  >  45266 [ACK] Seq=1 Ack=456721 Win=170496 Len=0 TSval=3788928 TSecr=3788798 SLE=459617 SRE=494369"
"375","7.105705486","10.0.0.3","10.0.0.2","TCP","1514","45266  >  34571 [ACK] Seq=508849 Ack=1 Win=29696 Len=1448 TSval=3788904 TSecr=3788879"
"376","7.118085531","10.0.0.3","10.0.0.2","TCP","1514","45266  >  34571 [ACK] Seq=510297 Ack=1 Win=29696 Len=1448 TSval=3788910 TSecr=3788885"
"377","7.122757219","10.0.0.2","10.0.0.3","TCP","78","[TCP Dup ACK 348#13] 34571  >  45266 [ACK] Seq=1 Ack=456721 Win=170496 Len=0 TSval=3788934 TSecr=3788798 SLE=459617 SRE=497265"
"378","7.135200218","10.0.0.2","10.0.0.3","TCP","78","[TCP Dup ACK 348#14] 34571  >  45266 [ACK] Seq=1 Ack=456721 Win=170496 Len=0 TSval=3788937 TSecr=3788798 SLE=459617 SRE=498713"
"379","7.141890925","10.0.0.3","10.0.0.2","TCP","2962","45266  >  34571 [ACK] Seq=511745 Ack=1 Win=29696 Len=2896 TSval=3788917 TSecr=3788891"
"380","7.154054931","10.0.0.3","10.0.0.2","TCP","1514","45266  >  34571 [ACK] Seq=514641 Ack=1 Win=29696 Len=1448 TSval=3788922 TSecr=3788897"
"381","7.159523074","10.0.0.2","10.0.0.3","TCP","78","[TCP Dup ACK 348#15] 34571  >  45266 [ACK] Seq=1 Ack=456721 Win=170496 Len=0 TSval=3788943 TSecr=3788798 SLE=459617 SRE=501609"
"382","7.178230941","10.0.0.3","10.0.0.2","TCP","2962","45266  >  34571 [ACK] Seq=516089 Ack=1 Win=29696 Len=2896 TSval=3788929 TSecr=3788903"
"383","7.184212172","10.0.0.2","10.0.0.3","TCP","78","[TCP Dup ACK 348#16] 34571  >  45266 [ACK] Seq=1 Ack=456721 Win=170496 Len=0 TSval=3788949 TSecr=3788798 SLE=459617 SRE=504505"
"384","7.190411382","10.0.0.3","10.0.0.2","TCP","1514","45266  >  34571 [ACK] Seq=518985 Ack=1 Win=29696 Len=1448 TSval=3788935 TSecr=3788910"
"385","7.195901496","10.0.0.2","10.0.0.3","TCP","78","34571  >  45266 [ACK] Seq=1 Ack=458169 Win=169472 Len=0 TSval=3788952 TSecr=3788886 SLE=459617 SRE=504505"
"386","7.202478318","10.0.0.3","10.0.0.2","TCP","1514","45266  >  34571 [ACK] Seq=520433 Ack=1 Win=29696 Len=1448 TSval=3788941 TSecr=3788916"
"387","7.208110230","10.0.0.2","10.0.0.3","TCP","78","[TCP Dup ACK 385#1] 34571  >  45266 [ACK] Seq=1 Ack=458169 Win=169472 Len=0 TSval=3788955 TSecr=3788886 SLE=459617 SRE=505953"
"388","7.221147989","10.0.0.2","10.0.0.3","TCP","66","34571  >  45266 [ACK] Seq=1 Ack=505953 Win=147456 Len=0 TSval=3788958 TSecr=3788892"
"389","7.226697346","10.0.0.3","10.0.0.2","TCP","2962","45266  >  34571 [ACK] Seq=521881 Ack=1 Win=29696 Len=2896 TSval=3788953 TSecr=3788928"
"390","7.244001864","10.0.0.2","10.0.0.3","TCP","66","34571  >  45266 [ACK] Seq=1 Ack=508849 Win=170496 Len=0 TSval=3788964 TSecr=3788898"
"391","7.250895111","10.0.0.3","10.0.0.2","TCP","2962","45266  >  34571 [ACK] Seq=524777 Ack=1 Win=29696 Len=2896 TSval=3788959 TSecr=3788934"
"392","7.262987999","10.0.0.3","10.0.0.2","TCP","1514","45266  >  34571 [ACK] Seq=527673 Ack=1 Win=29696 Len=1448 TSval=3788962 TSecr=3788937"
"393","7.268282217","10.0.0.2","10.0.0.3","TCP","66","34571  >  45266 [ACK] Seq=1 Ack=511745 Win=170496 Len=0 TSval=3788970 TSecr=3788904"
"394","7.287235588","10.0.0.3","10.0.0.2","TCP","2962","45266  >  34571 [ACK] Seq=529121 Ack=1 Win=29696 Len=2896 TSval=3788968 TSecr=3788943"
"395","7.292210655","10.0.0.2","10.0.0.3","TCP","66","34571  >  45266 [ACK] Seq=1 Ack=514641 Win=170496 Len=0 TSval=3788976 TSecr=3788917"
"396","7.311459802","10.0.0.3","10.0.0.2","TCP","2962","45266  >  34571 [ACK] Seq=532017 Ack=1 Win=29696 Len=2896 TSval=3788974 TSecr=3788949"
"397","7.323594028","10.0.0.3","10.0.0.2","TCP","1514","45266  >  34571 [ACK] Seq=534913 Ack=1 Win=29696 Len=1448 TSval=3788977 TSecr=3788952"
"398","7.328374320","10.0.0.2","10.0.0.3","TCP","66","34571  >  45266 [ACK] Seq=1 Ack=518985 Win=170496 Len=0 TSval=3788985 TSecr=3788922"
"399","7.335661266","10.0.0.3","10.0.0.2","TCP","1514","45266  >  34571 [ACK] Seq=536361 Ack=1 Win=29696 Len=1448 TSval=3788980 TSecr=3788955"
"400","7.353141995","10.0.0.2","10.0.0.3","TCP","66","34571  >  45266 [ACK] Seq=1 Ack=521881 Win=170496 Len=0 TSval=3788991 TSecr=3788935"
"401","7.359876194","10.0.0.3","10.0.0.2","TCP","2962","45266  >  34571 [ACK] Seq=537809 Ack=1 Win=29696 Len=2896 TSval=3788983 TSecr=3788958"
"402","7.377115923","10.0.0.2","10.0.0.3","TCP","66","34571  >  45266 [ACK] Seq=1 Ack=524777 Win=170496 Len=0 TSval=3788997 TSecr=3788953"
"403","7.384131508","10.0.0.3","10.0.0.2","TCP","2962","45266  >  34571 [ACK] Seq=540705 Ack=1 Win=29696 Len=2896 TSval=3788983 TSecr=3788958"
"404","7.396225047","10.0.0.3","10.0.0.2","TCP","1514","45266  >  34571 [ACK] Seq=543601 Ack=1 Win=29696 Len=1448 TSval=3788983 TSecr=3788958"
"405","7.401121047","10.0.0.2","10.0.0.3","TCP","66","34571  >  45266 [ACK] Seq=1 Ack=527673 Win=170496 Len=0 TSval=3789003 TSecr=3788959"
"406","7.420758622","10.0.0.3","10.0.0.2","TCP","2962","45266  >  34571 [ACK] Seq=545049 Ack=1 Win=29696 Len=2896 TSval=3788989 TSecr=3788964"
"407","7.437405296","10.0.0.2","10.0.0.3","TCP","66","34571  >  45266 [ACK] Seq=1 Ack=532017 Win=170496 Len=0 TSval=3789012 TSecr=3788962"
"408","7.444668317","10.0.0.3","10.0.0.2","TCP","2962","45266  >  34571 [ACK] Seq=547945 Ack=1 Win=29696 Len=2896 TSval=3788995 TSecr=3788970"
"409","7.461622469","10.0.0.2","10.0.0.3","TCP","66","34571  >  45266 [ACK] Seq=1 Ack=534913 Win=170496 Len=0 TSval=3789018 TSecr=3788974"
"410","7.468989962","10.0.0.3","10.0.0.2","TCP","2962","45266  >  34571 [ACK] Seq=550841 Ack=1 Win=29696 Len=2896 TSval=3789001 TSecr=3788976"
"411","7.486114055","10.0.0.2","10.0.0.3","TCP","66","34571  >  45266 [ACK] Seq=1 Ack=537809 Win=170496 Len=0 TSval=3789025 TSecr=3788977"
"412","7.493158838","10.0.0.3","10.0.0.2","TCP","2962","45266  >  34571 [ACK] Seq=553737 Ack=1 Win=29696 Len=2896 TSval=3789010 TSecr=3788985"
"413","7.510164706","10.0.0.2","10.0.0.3","TCP","66","34571  >  45266 [ACK] Seq=1 Ack=540705 Win=170496 Len=0 TSval=3789031 TSecr=3788983"
"414","7.517474264","10.0.0.3","10.0.0.2","TCP","2962","45266  >  34571 [ACK] Seq=556633 Ack=1 Win=29696 Len=2896 TSval=3789016 TSecr=3788991"
"415","7.534679607","10.0.0.2","10.0.0.3","TCP","66","34571  >  45266 [ACK] Seq=1 Ack=543601 Win=176640 Len=0 TSval=3789037 TSecr=3788983"
"416","7.541630072","10.0.0.3","10.0.0.2","TCP","2962","45266  >  34571 [ACK] Seq=559529 Ack=1 Win=29696 Len=2896 TSval=3789022 TSecr=3788997"
"417","7.546760750","10.0.0.2","10.0.0.3","TCP","66","34571  >  45266 [ACK] Seq=1 Ack=545049 Win=179200 Len=0 TSval=3789040 TSecr=3788983"
"418","7.566085967","10.0.0.3","10.0.0.2","TCP","2962","45266  >  34571 [ACK] Seq=562425 Ack=1 Win=29696 Len=2896 TSval=3789028 TSecr=3789003"
"419","7.571242285","10.0.0.2","10.0.0.3","TCP","66","34571  >  45266 [ACK] Seq=1 Ack=547945 Win=185344 Len=0 TSval=3789046 TSecr=3788989"
"420","7.590194305","10.0.0.3","10.0.0.2","TCP","2962","45266  >  34571 [ACK] Seq=565321 Ack=1 Win=29696 Len=2896 TSval=3789037 TSecr=3789012"
"421","7.594904445","10.0.0.2","10.0.0.3","TCP","66","34571  >  45266 [ACK] Seq=1 Ack=550841 Win=190976 Len=0 TSval=3789052 TSecr=3788995"
"422","7.614265880","10.0.0.3","10.0.0.2","TCP","2962","45266  >  34571 [ACK] Seq=568217 Ack=1 Win=29696 Len=2896 TSval=3789037 TSecr=3789012"
"423","7.619493080","10.0.0.2","10.0.0.3","TCP","66","34571  >  45266 [ACK] Seq=1 Ack=553737 Win=196608 Len=0 TSval=3789058 TSecr=3789001"
"424","7.638736347","10.0.0.3","10.0.0.2","TCP","2962","45266  >  34571 [ACK] Seq=571113 Ack=1 Win=29696 Len=2896 TSval=3789044 TSecr=3789018"
"425","7.643420619","10.0.0.2","10.0.0.3","TCP","66","34571  >  45266 [ACK] Seq=1 Ack=556633 Win=202240 Len=0 TSval=3789064 TSecr=3789010"
"426","7.662833729","10.0.0.3","10.0.0.2","TCP","2962","45266  >  34571 [ACK] Seq=574009 Ack=1 Win=29696 Len=2896 TSval=3789050 TSecr=3789025"
"427","7.668128036","10.0.0.2","10.0.0.3","TCP","66","34571  >  45266 [ACK] Seq=1 Ack=559529 Win=208384 Len=0 TSval=3789070 TSecr=3789016"
"428","7.686980610","10.0.0.3","10.0.0.2","TCP","2962","45266  >  34571 [ACK] Seq=576905 Ack=1 Win=29696 Len=2896 TSval=3789056 TSecr=3789031"
"429","7.691906504","10.0.0.2","10.0.0.3","TCP","66","34571  >  45266 [ACK] Seq=1 Ack=562425 Win=214016 Len=0 TSval=3789076 TSecr=3789022"
"430","7.711150278","10.0.0.3","10.0.0.2","TCP","2962","45266  >  34571 [ACK] Seq=579801 Ack=1 Win=29696 Len=2896 TSval=3789062 TSecr=3789037"
"431","7.717069357","10.0.0.2","10.0.0.3","TCP","66","34571  >  45266 [ACK] Seq=1 Ack=565321 Win=219648 Len=0 TSval=3789082 TSecr=3789028"
"432","7.735361347","10.0.0.3","10.0.0.2","TCP","2962","45266  >  34571 [ACK] Seq=582697 Ack=1 Win=29696 Len=2896 TSval=3789065 TSecr=3789040"
"433","7.740810500","10.0.0.2","10.0.0.3","TCP","66","34571  >  45266 [ACK] Seq=1 Ack=568217 Win=225792 Len=0 TSval=3789088 TSecr=3789037"
"434","7.759572870","10.0.0.3","10.0.0.2","TCP","2962","45266  >  34571 [ACK] Seq=585593 Ack=1 Win=29696 Len=2896 TSval=3789071 TSecr=3789046"
"435","7.764587330","10.0.0.2","10.0.0.3","TCP","66","34571  >  45266 [ACK] Seq=1 Ack=571113 Win=231424 Len=0 TSval=3789094 TSecr=3789037"
"436","7.783803854","10.0.0.3","10.0.0.2","TCP","2962","45266  >  34571 [ACK] Seq=588489 Ack=1 Win=29696 Len=2896 TSval=3789077 TSecr=3789052"
"437","7.789358903","10.0.0.2","10.0.0.3","TCP","66","34571  >  45266 [ACK] Seq=1 Ack=574009 Win=237056 Len=0 TSval=3789100 TSecr=3789044"
"438","7.808040062","10.0.0.3","10.0.0.2","TCP","2962","45266  >  34571 [ACK] Seq=591385 Ack=1 Win=29696 Len=2896 TSval=3789083 TSecr=3789058"
"439","7.813031485","10.0.0.2","10.0.0.3","TCP","66","34571  >  45266 [ACK] Seq=1 Ack=576905 Win=243200 Len=0 TSval=3789106 TSecr=3789050"
"440","7.832254219","10.0.0.3","10.0.0.2","TCP","2962","45266  >  34571 [ACK] Seq=594281 Ack=1 Win=29696 Len=2896 TSval=3789089 TSecr=3789064"
"441","7.837313940","10.0.0.2","10.0.0.3","TCP","66","34571  >  45266 [ACK] Seq=1 Ack=579801 Win=248832 Len=0 TSval=3789112 TSecr=3789056"
"442","7.856480147","10.0.0.3","10.0.0.2","TCP","2962","45266  >  34571 [ACK] Seq=597177 Ack=1 Win=29696 Len=2896 TSval=3789095 TSecr=3789070"
"443","7.861346105","10.0.0.2","10.0.0.3","TCP","66","34571  >  45266 [ACK] Seq=1 Ack=582697 Win=254464 Len=0 TSval=3789118 TSecr=3789062"
"444","7.880727331","10.0.0.3","10.0.0.2","TCP","2962","45266  >  34571 [ACK] Seq=600073 Ack=1 Win=29696 Len=2896 TSval=3789101 TSecr=3789076"
"445","7.885892727","10.0.0.2","10.0.0.3","TCP","66","34571  >  45266 [ACK] Seq=1 Ack=585593 Win=260608 Len=0 TSval=3789124 TSecr=3789065"
"446","7.904918824","10.0.0.3","10.0.0.2","TCP","2962","45266  >  34571 [ACK] Seq=602969 Ack=1 Win=29696 Len=2896 TSval=3789107 TSecr=3789082"
"447","7.909731688","10.0.0.2","10.0.0.3","TCP","66","34571  >  45266 [ACK] Seq=1 Ack=588489 Win=266240 Len=0 TSval=3789131 TSecr=3789071"
"448","7.929143076","10.0.0.3","10.0.0.2","TCP","2962","45266  >  34571 [ACK] Seq=605865 Ack=1 Win=29696 Len=2896 TSval=3789113 TSecr=3789088"
"449","7.934345419","10.0.0.2","10.0.0.3","TCP","66","34571  >  45266 [ACK] Seq=1 Ack=591385 Win=271872 Len=0 TSval=3789137 TSecr=3789077"
"450","7.941297582","10.0.0.3","10.0.0.2","TCP","1514","45266  >  34571 [ACK] Seq=608761 Ack=1 Win=29696 Len=1448 TSval=3789119 TSecr=3789094"
"451","7.958186882","10.0.0.2","10.0.0.3","TCP","66","34571  >  45266 [ACK] Seq=1 Ack=594281 Win=278016 Len=0 TSval=3789143 TSecr=3789083"
"452","7.965567714","10.0.0.3","10.0.0.2","TCP","2962","45266  >  34571 [ACK] Seq=610209 Ack=1 Win=29696 Len=2896 TSval=3789125 TSecr=3789100"
"453","7.982773327","10.0.0.2","10.0.0.3","TCP","66","34571  >  45266 [ACK] Seq=1 Ack=597177 Win=283648 Len=0 TSval=3789149 TSecr=3789089"
"454","7.989707702","10.0.0.3","10.0.0.2","TCP","2962","45266  >  34571 [ACK] Seq=613105 Ack=1 Win=29696 Len=2896 TSval=3789125 TSecr=3789100"
"455","8.007054104","10.0.0.2","10.0.0.3","TCP","66","34571  >  45266 [ACK] Seq=1 Ack=600073 Win=289280 Len=0 TSval=3789155 TSecr=3789095"
"456","8.014251662","10.0.0.3","10.0.0.2","TCP","2962","45266  >  34571 [ACK] Seq=616001 Ack=1 Win=29696 Len=2896 TSval=3789131 TSecr=3789106"
"457","8.031331639","10.0.0.2","10.0.0.3","TCP","66","34571  >  45266 [ACK] Seq=1 Ack=602969 Win=294912 Len=0 TSval=3789161 TSecr=3789101"
"458","8.038177378","10.0.0.3","10.0.0.2","TCP","2962","45266  >  34571 [ACK] Seq=618897 Ack=1 Win=29696 Len=2896 TSval=3789137 TSecr=3789112"
"459","8.055347378","10.0.0.2","10.0.0.3","TCP","66","34571  >  45266 [ACK] Seq=1 Ack=605865 Win=301056 Len=0 TSval=3789167 TSecr=3789107"
"460","8.062484474","10.0.0.3","10.0.0.2","TCP","2962","45266  >  34571 [ACK] Seq=621793 Ack=1 Win=29696 Len=2896 TSval=3789143 TSecr=3789118"
"461","8.079556255","10.0.0.2","10.0.0.3","TCP","66","34571  >  45266 [ACK] Seq=1 Ack=608761 Win=306688 Len=0 TSval=3789173 TSecr=3789113"
"462","8.086828314","10.0.0.3","10.0.0.2","TCP","2962","45266  >  34571 [ACK] Seq=624689 Ack=1 Win=29696 Len=2896 TSval=3789150 TSecr=3789124"
"463","8.092354830","10.0.0.2","10.0.0.3","TCP","66","34571  >  45266 [ACK] Seq=1 Ack=610209 Win=309760 Len=0 TSval=3789176 TSecr=3789119"
"464","8.110951755","10.0.0.3","10.0.0.2","TCP","2962","45266  >  34571 [ACK] Seq=627585 Ack=1 Win=29696 Len=2896 TSval=3789156 TSecr=3789131"
"465","8.116117340","10.0.0.2","10.0.0.3","TCP","66","34571  >  45266 [ACK] Seq=1 Ack=613105 Win=315392 Len=0 TSval=3789182 TSecr=3789125"
"466","8.135251743","10.0.0.3","10.0.0.2","TCP","2962","45266  >  34571 [ACK] Seq=630481 Ack=1 Win=29696 Len=2896 TSval=3789162 TSecr=3789137"
"467","8.140401368","10.0.0.2","10.0.0.3","TCP","66","34571  >  45266 [ACK] Seq=1 Ack=616001 Win=321024 Len=0 TSval=3789188 TSecr=3789125"
"468","8.159292634","10.0.0.3","10.0.0.2","TCP","2962","45266  >  34571 [ACK] Seq=633377 Ack=1 Win=29696 Len=2896 TSval=3789168 TSecr=3789143"
"469","8.165317603","10.0.0.2","10.0.0.3","TCP","66","34571  >  45266 [ACK] Seq=1 Ack=618897 Win=327168 Len=0 TSval=3789194 TSecr=3789131"
"470","8.183561590","10.0.0.3","10.0.0.2","TCP","2962","45266  >  34571 [ACK] Seq=636273 Ack=1 Win=29696 Len=2896 TSval=3789174 TSecr=3789149"
"471","8.188417002","10.0.0.2","10.0.0.3","TCP","66","34571  >  45266 [ACK] Seq=1 Ack=621793 Win=332800 Len=0 TSval=3789200 TSecr=3789137"
"472","8.207743550","10.0.0.3","10.0.0.2","TCP","2962","45266  >  34571 [ACK] Seq=639169 Ack=1 Win=29696 Len=2896 TSval=3789180 TSecr=3789155"
"473","8.213353555","10.0.0.2","10.0.0.3","TCP","66","34571  >  45266 [ACK] Seq=1 Ack=624689 Win=338432 Len=0 TSval=3789206 TSecr=3789143"
"474","8.231951429","10.0.0.3","10.0.0.2","TCP","2962","45266  >  34571 [ACK] Seq=642065 Ack=1 Win=29696 Len=2896 TSval=3789186 TSecr=3789161"
"475","8.237081513","10.0.0.2","10.0.0.3","TCP","66","34571  >  45266 [ACK] Seq=1 Ack=627585 Win=344576 Len=0 TSval=3789212 TSecr=3789150"
"476","8.256260119","10.0.0.3","10.0.0.2","TCP","2962","45266  >  34571 [ACK] Seq=644961 Ack=1 Win=29696 Len=2896 TSval=3789192 TSecr=3789167"
"477","8.261395001","10.0.0.2","10.0.0.3","TCP","66","34571  >  45266 [ACK] Seq=1 Ack=630481 Win=350208 Len=0 TSval=3789218 TSecr=3789156"
"478","8.280761601","10.0.0.3","10.0.0.2","TCP","2962","45266  >  34571 [ACK] Seq=647857 Ack=1 Win=29696 Len=2896 TSval=3789198 TSecr=3789173"
"479","8.285578872","10.0.0.2","10.0.0.3","TCP","66","34571  >  45266 [ACK] Seq=1 Ack=633377 Win=355840 Len=0 TSval=3789224 TSecr=3789162"
"480","8.304629986","10.0.0.3","10.0.0.2","TCP","2962","45266  >  34571 [ACK] Seq=650753 Ack=1 Win=29696 Len=2896 TSval=3789201 TSecr=3789176"
"481","8.310003804","10.0.0.2","10.0.0.3","TCP","66","34571  >  45266 [ACK] Seq=1 Ack=636273 Win=361984 Len=0 TSval=3789231 TSecr=3789168"
"482","8.328882405","10.0.0.3","10.0.0.2","TCP","2962","45266  >  34571 [ACK] Seq=653649 Ack=1 Win=29696 Len=2896 TSval=3789207 TSecr=3789182"
"483","8.334290476","10.0.0.2","10.0.0.3","TCP","66","34571  >  45266 [ACK] Seq=1 Ack=639169 Win=367616 Len=0 TSval=3789237 TSecr=3789174"
"484","8.353118335","10.0.0.3","10.0.0.2","TCP","2962","45266  >  34571 [ACK] Seq=656545 Ack=1 Win=29696 Len=2896 TSval=3789213 TSecr=3789188"
"485","8.357965221","10.0.0.2","10.0.0.3","TCP","66","34571  >  45266 [ACK] Seq=1 Ack=642065 Win=371712 Len=0 TSval=3789243 TSecr=3789180"
"486","8.377525022","10.0.0.3","10.0.0.2","TCP","2962","45266  >  34571 [ACK] Seq=659441 Ack=1 Win=29696 Len=2896 TSval=3789219 TSecr=3789194"
"487","8.382627129","10.0.0.2","10.0.0.3","TCP","66","34571  >  45266 [ACK] Seq=1 Ack=644961 Win=371712 Len=0 TSval=3789249 TSecr=3789186"
"488","8.401656965","10.0.0.3","10.0.0.2","TCP","2962","45266  >  34571 [ACK] Seq=662337 Ack=1 Win=29696 Len=2896 TSval=3789225 TSecr=3789200"
"489","8.406780070","10.0.0.2","10.0.0.3","TCP","66","34571  >  45266 [ACK] Seq=1 Ack=647857 Win=371712 Len=0 TSval=3789255 TSecr=3789192"
"490","8.425733202","10.0.0.3","10.0.0.2","TCP","2962","45266  >  34571 [ACK] Seq=665233 Ack=1 Win=29696 Len=2896 TSval=3789231 TSecr=3789206"
"491","8.431114430","10.0.0.2","10.0.0.3","TCP","66","34571  >  45266 [ACK] Seq=1 Ack=650753 Win=371712 Len=0 TSval=3789261 TSecr=3789198"
"492","8.449997128","10.0.0.3","10.0.0.2","TCP","2962","45266  >  34571 [ACK] Seq=668129 Ack=1 Win=29696 Len=2896 TSval=3789237 TSecr=3789212"
"493","8.455354864","10.0.0.2","10.0.0.3","TCP","66","34571  >  45266 [ACK] Seq=1 Ack=653649 Win=371712 Len=0 TSval=3789267 TSecr=3789201"
"494","8.474285744","10.0.0.3","10.0.0.2","TCP","2962","45266  >  34571 [ACK] Seq=671025 Ack=1 Win=29696 Len=2896 TSval=3789243 TSecr=3789218"
"495","8.479924367","10.0.0.2","10.0.0.3","TCP","66","34571  >  45266 [ACK] Seq=1 Ack=656545 Win=371712 Len=0 TSval=3789273 TSecr=3789207"
"496","8.498581253","10.0.0.3","10.0.0.2","TCP","2962","45266  >  34571 [ACK] Seq=673921 Ack=1 Win=29696 Len=2896 TSval=3789250 TSecr=3789224"
"497","8.503720880","10.0.0.2","10.0.0.3","TCP","66","34571  >  45266 [ACK] Seq=1 Ack=659441 Win=371712 Len=0 TSval=3789279 TSecr=3789213"
"498","8.522883359","10.0.0.3","10.0.0.2","TCP","2962","45266  >  34571 [ACK] Seq=676817 Ack=1 Win=29696 Len=2896 TSval=3789256 TSecr=3789231"
"499","8.528325644","10.0.0.2","10.0.0.3","TCP","66","34571  >  45266 [ACK] Seq=1 Ack=662337 Win=371712 Len=0 TSval=3789285 TSecr=3789219"
"500","8.546958876","10.0.0.3","10.0.0.2","TCP","2962","45266  >  34571 [ACK] Seq=679713 Ack=1 Win=29696 Len=2896 TSval=3789262 TSecr=3789237"
"501","8.552709218","10.0.0.2","10.0.0.3","TCP","66","34571  >  45266 [ACK] Seq=1 Ack=665233 Win=371712 Len=0 TSval=3789291 TSecr=3789225"
"502","8.571527272","10.0.0.3","10.0.0.2","TCP","2962","45266  >  34571 [ACK] Seq=682609 Ack=1 Win=29696 Len=2896 TSval=3789268 TSecr=3789243"
"503","8.576221212","10.0.0.2","10.0.0.3","TCP","66","34571  >  45266 [ACK] Seq=1 Ack=668129 Win=371712 Len=0 TSval=3789297 TSecr=3789231"
"504","8.595384359","10.0.0.3","10.0.0.2","TCP","2962","45266  >  34571 [ACK] Seq=685505 Ack=1 Win=29696 Len=2896 TSval=3789274 TSecr=3789249"
"505","8.600571844","10.0.0.2","10.0.0.3","TCP","66","34571  >  45266 [ACK] Seq=1 Ack=671025 Win=371712 Len=0 TSval=3789303 TSecr=3789237"
"506","8.619862678","10.0.0.3","10.0.0.2","TCP","2962","45266  >  34571 [ACK] Seq=688401 Ack=1 Win=29696 Len=2896 TSval=3789280 TSecr=3789255"
"507","8.625033615","10.0.0.2","10.0.0.3","TCP","66","34571  >  45266 [ACK] Seq=1 Ack=673921 Win=371712 Len=0 TSval=3789309 TSecr=3789243"
"508","8.643963908","10.0.0.3","10.0.0.2","TCP","2962","45266  >  34571 [ACK] Seq=691297 Ack=1 Win=29696 Len=2896 TSval=3789286 TSecr=3789261"
"509","8.649236474","10.0.0.2","10.0.0.3","TCP","66","34571  >  45266 [ACK] Seq=1 Ack=676817 Win=371712 Len=0 TSval=3789315 TSecr=3789250"
"510","8.667971080","10.0.0.3","10.0.0.2","TCP","2962","45266  >  34571 [ACK] Seq=694193 Ack=1 Win=29696 Len=2896 TSval=3789292 TSecr=3789267"
"511","8.673569166","10.0.0.2","10.0.0.3","TCP","66","34571  >  45266 [ACK] Seq=1 Ack=679713 Win=371712 Len=0 TSval=3789321 TSecr=3789256"
"512","8.692205986","10.0.0.3","10.0.0.2","TCP","2962","45266  >  34571 [ACK] Seq=697089 Ack=1 Win=29696 Len=2896 TSval=3789298 TSecr=3789273"
"513","8.697701304","10.0.0.2","10.0.0.3","TCP","66","34571  >  45266 [ACK] Seq=1 Ack=682609 Win=371712 Len=0 TSval=3789327 TSecr=3789262"
"514","8.704315291","10.0.0.3","10.0.0.2","TCP","1514","45266  >  34571 [ACK] Seq=699985 Ack=1 Win=29696 Len=1448 TSval=3789298 TSecr=3789273"
"515","8.722054788","10.0.0.2","10.0.0.3","TCP","66","34571  >  45266 [ACK] Seq=1 Ack=685505 Win=371712 Len=0 TSval=3789334 TSecr=3789268"
"516","8.728632183","10.0.0.3","10.0.0.2","TCP","2962","45266  >  34571 [ACK] Seq=701433 Ack=1 Win=29696 Len=2896 TSval=3789304 TSecr=3789279"
"517","8.746091661","10.0.0.2","10.0.0.3","TCP","66","34571  >  45266 [ACK] Seq=1 Ack=688401 Win=371712 Len=0 TSval=3789340 TSecr=3789274"
"518","8.752791927","10.0.0.3","10.0.0.2","TCP","2962","45266  >  34571 [ACK] Seq=704329 Ack=1 Win=29696 Len=2896 TSval=3789310 TSecr=3789285"
"519","8.769959198","10.0.0.2","10.0.0.3","TCP","66","34571  >  45266 [ACK] Seq=1 Ack=691297 Win=371712 Len=0 TSval=3789346 TSecr=3789280"
"520","8.777107810","10.0.0.3","10.0.0.2","TCP","2962","45266  >  34571 [ACK] Seq=707225 Ack=1 Win=29696 Len=2896 TSval=3789316 TSecr=3789291"
"521","8.794606618","10.0.0.2","10.0.0.3","TCP","66","34571  >  45266 [ACK] Seq=1 Ack=694193 Win=371712 Len=0 TSval=3789352 TSecr=3789286"
"522","8.801219750","10.0.0.3","10.0.0.2","TCP","2962","45266  >  34571 [ACK] Seq=710121 Ack=1 Win=29696 Len=2896 TSval=3789322 TSecr=3789297"
"523","8.813451888","10.0.0.3","10.0.0.2","TCP","1514","45266  >  34571 [ACK] Seq=713017 Ack=1 Win=29696 Len=1448 TSval=3789322 TSecr=3789297"
"524","8.818081997","10.0.0.2","10.0.0.3","TCP","66","34571  >  45266 [ACK] Seq=1 Ack=697089 Win=371712 Len=0 TSval=3789358 TSecr=3789292"
"525","8.837642225","10.0.0.3","10.0.0.2","TCP","2962","45266  >  34571 [ACK] Seq=714465 Ack=1 Win=29696 Len=2896 TSval=3789328 TSecr=3789303"
"526","8.842438412","10.0.0.2","10.0.0.3","TCP","66","34571  >  45266 [ACK] Seq=1 Ack=699985 Win=371712 Len=0 TSval=3789364 TSecr=3789298"
"527","8.861822552","10.0.0.3","10.0.0.2","TCP","2962","45266  >  34571 [ACK] Seq=717361 Ack=1 Win=29696 Len=2896 TSval=3789334 TSecr=3789309"
"528","8.878790369","10.0.0.2","10.0.0.3","TCP","66","34571  >  45266 [ACK] Seq=1 Ack=704329 Win=371712 Len=0 TSval=3789373 TSecr=3789298"
"529","8.885992617","10.0.0.3","10.0.0.2","TCP","2962","45266  >  34571 [ACK] Seq=720257 Ack=1 Win=29696 Len=2896 TSval=3789340 TSecr=3789315"
"530","8.902962617","10.0.0.2","10.0.0.3","TCP","66","34571  >  45266 [ACK] Seq=1 Ack=707225 Win=371712 Len=0 TSval=3789379 TSecr=3789310"
"531","8.910225980","10.0.0.3","10.0.0.2","TCP","2962","45266  >  34571 [ACK] Seq=723153 Ack=1 Win=29696 Len=2896 TSval=3789347 TSecr=3789321"
"532","8.927321043","10.0.0.2","10.0.0.3","TCP","66","34571  >  45266 [ACK] Seq=1 Ack=710121 Win=371712 Len=0 TSval=3789385 TSecr=3789316"
"533","8.934454884","10.0.0.3","10.0.0.2","TCP","2962","45266  >  34571 [ACK] Seq=726049 Ack=1 Win=29696 Len=2896 TSval=3789353 TSecr=3789327"
"534","8.951430134","10.0.0.2","10.0.0.3","TCP","66","34571  >  45266 [ACK] Seq=1 Ack=713017 Win=371712 Len=0 TSval=3789391 TSecr=3789322"
"535","8.958663360","10.0.0.3","10.0.0.2","TCP","2962","45266  >  34571 [ACK] Seq=728945 Ack=1 Win=29696 Len=2896 TSval=3789359 TSecr=3789334"
"536","8.983268320","10.0.0.3","10.0.0.2","TCP","2962","45266  >  34571 [ACK] Seq=731841 Ack=1 Win=29696 Len=2896 TSval=3789365 TSecr=3789340"
"537","8.988007104","10.0.0.2","10.0.0.3","TCP","66","34571  >  45266 [ACK] Seq=1 Ack=717361 Win=371712 Len=0 TSval=3789400 TSecr=3789322"
"538","9.007416968","10.0.0.3","10.0.0.2","TCP","2962","45266  >  34571 [ACK] Seq=734737 Ack=1 Win=29696 Len=2896 TSval=3789371 TSecr=3789346"
"539","9.011976616","10.0.0.2","10.0.0.3","TCP","66","34571  >  45266 [ACK] Seq=1 Ack=720257 Win=371712 Len=0 TSval=3789406 TSecr=3789334"
"540","9.031366293","10.0.0.3","10.0.0.2","TCP","2962","45266  >  34571 [ACK] Seq=737633 Ack=1 Win=29696 Len=2896 TSval=3789377 TSecr=3789352"
"541","9.036602791","10.0.0.2","10.0.0.3","TCP","66","34571  >  45266 [ACK] Seq=1 Ack=723153 Win=371712 Len=0 TSval=3789412 TSecr=3789340"
"542","9.055601309","10.0.0.3","10.0.0.2","TCP","2962","45266  >  34571 [ACK] Seq=740529 Ack=1 Win=29696 Len=2896 TSval=3789383 TSecr=3789358"
"543","9.061318490","10.0.0.2","10.0.0.3","TCP","66","34571  >  45266 [ACK] Seq=1 Ack=726049 Win=371712 Len=0 TSval=3789418 TSecr=3789347"
"544","9.069317502","10.0.0.3","10.0.0.2","TCP","1649","45266  >  34571 [FIN, PSH, ACK] Seq=743425 Ack=1 Win=29696 Len=1583 TSval=3789389 TSecr=3789364"
"545","9.085320406","10.0.0.2","10.0.0.3","TCP","66","34571  >  45266 [ACK] Seq=1 Ack=728945 Win=371712 Len=0 TSval=3789424 TSecr=3789353"
"546","9.109356338","10.0.0.2","10.0.0.3","TCP","66","34571  >  45266 [ACK] Seq=1 Ack=731841 Win=371712 Len=0 TSval=3789430 TSecr=3789359"
"547","9.133916336","10.0.0.2","10.0.0.3","TCP","66","34571  >  45266 [ACK] Seq=1 Ack=734737 Win=371712 Len=0 TSval=3789437 TSecr=3789365"
"548","9.157798268","10.0.0.2","10.0.0.3","TCP","66","34571  >  45266 [ACK] Seq=1 Ack=737633 Win=371712 Len=0 TSval=3789442 TSecr=3789371"
"549","9.181945329","10.0.0.2","10.0.0.3","TCP","66","34571  >  45266 [ACK] Seq=1 Ack=740529 Win=371712 Len=0 TSval=3789449 TSecr=3789377"
"550","9.205787969","10.0.0.2","10.0.0.3","TCP","66","34571  >  45266 [ACK] Seq=1 Ack=743425 Win=371712 Len=0 TSval=3789455 TSecr=3789383"
"551","9.219694309","10.0.0.2","10.0.0.3","TCP","66","34571  >  45266 [ACK] Seq=1 Ack=745009 Win=372224 Len=0 TSval=3789458 TSecr=3789389"
"552","9.219750203","10.0.0.2","10.0.0.3","TCP","66","34571  >  45266 [FIN, ACK] Seq=1 Ack=745009 Win=373248 Len=0 TSval=3789458 TSecr=3789389"
"553","9.270364811","10.0.0.3","10.0.0.2","TCP","66","45266  >  34571 [ACK] Seq=745009 Ack=2 Win=29696 Len=0 TSval=3789483 TSecr=3789458"
